CQS Symbol,ETF,Financial Status,Listing Exchange,Market Category,NASDAQ Symbol,Nasdaq Traded,NextShares,Round Lot Size,Security Name,Symbol,Test Issue
"",N,N,Q,S,REAX,Y,N,100,"The Real Brokerage, Inc. - Common Shares",REAX,N
"",N,N,Q,S,REBN,Y,N,100,"Reborn Coffee, Inc. - Common Stock",REBN,N
RECS,Y,"",P, ,RECS,Y,N,100,Columbia Research Enhanced Core ETF,RECS,N
"",N,D,Q,G,REE,Y,N,100,REE Automotive Ltd. - Class A Ordinary Shares,REE,N
"",N,D,Q,S,REED,Y,N,100,"Reeds, Inc. - Common Stock",REED,N
REET,Y,"",P, ,REET,Y,N,100,iShares Trust iShares Global REIT ETF,REET,N
"",N,N,Q,G,REFI,Y,N,100,"Chicago Atlantic Real Estate Finance, Inc. - Common Stock",REFI,N
"",N,N,Q,S,REFR,Y,N,100,Research Frontiers Incorporated - Common Stock,REFR,N
"",N,N,Q,Q,REG,Y,N,100,Regency Centers Corporation - Common Stock,REG,N
REGL,Y,"",Z, ,REGL,Y,N,100,ProShares S&P MidCap 400 Dividend Aristocrats ETF,REGL,N
"",N,N,Q,Q,REGN,Y,N,100,"Regeneron Pharmaceuticals, Inc. - Common Stock",REGN,N
REI,N,"",A, ,REI,Y,N,100,"Ring Energy, Inc. Common Stock",REI,N
"",Y,N,Q,G,REIT,Y,N,100,ALPS Active REIT ETF,REIT,N
REK,Y,"",P, ,REK,Y,N,100,ProShares Short Real Estate,REK,N
"",N,N,Q,S,REKR,Y,N,100,"Rekor Systems, Inc. - Common Stock",REKR,N
"",N,D,Q,S,RELI,Y,N,100,"Reliance Global Group, Inc. - Common Stock",RELI,N
"",N,N,Q,S,RELIW,Y,N,100,"Reliance Global Group, Inc. - Series A Warrants",RELIW,N
"",N,N,Q,Q,RELL,Y,N,100,"Richardson Electronics, Ltd. - Common Stock",RELL,N
RELX,N,"",N, ,RELX,Y,N,100,RELX PLC PLC American Depositary Shares (Each representing One Ordinary Share),RELX,N
"",N,N,Q,Q,RELY,Y,N,100,"Remitly Global, Inc. - Common stock",RELY,N
REM,Y,"",Z, ,REM,Y,N,100,iShares Trust iShares Mortgage Real Estate ETF,REM,N
REMG,Y,"",P, ,REMG,Y,N,100,SSGA Active Trust SPDR Bloomberg SASB Emerging Markets ESG Select ETF,REMG,N
REMX,Y,"",P, ,REMX,Y,N,100,VanEck Rare Earth/Strategic Metals ETF ,REMX,N
"",N,N,Q,G,RENE,Y,N,100,Cartesian Growth Corporation II - Class A Ordinary Shares,RENE,N
"",N,N,Q,G,RENEU,Y,N,100,Cartesian Growth Corporation II - Unit,RENEU,N
"",N,N,Q,G,RENEW,Y,N,100,Cartesian Growth Corporation II - Warrant,RENEW,N
RENN,N,"",N, ,RENN,Y,N,100,"Renren Inc. American Depositary Shares, each representing fifteen Class A ordinary shares",RENN,N
"",N,N,Q,Q,RENT,Y,N,100,"Rent the Runway, Inc. - Class A Common Stock",RENT,N
RENW,Y,"",P, ,RENW,Y,N,100,Harbor ETF Trust Harbor Energy Transition Strategy ETF,RENW,N
"",N,N,Q,Q,REPL,Y,N,100,"Replimune Group, Inc. - Common Stock",REPL,N
REPX,N,"",A, ,REPX,Y,N,100,"Riley Exploration Permian, Inc. Common Stock",REPX,N
RERE,N,"",N, ,RERE,Y,N,100,ATRenew Inc. American Depositary Shares (every three of which representing two Class A ordinary shares),RERE,N
RES,N,"",N, ,RES,Y,N,100,"RPC, Inc. Common Stock",RES,N
RESD,Y,"",Z, ,RESD,Y,N,100,WisdomTree International ESG Fund,RESD,N
RESE,Y,"",Z, ,RESE,Y,N,100,WisdomTree Emerging Markets ESG Fund,RESE,N
RESI,Y,"",P, ,RESI,Y,N,100,Kelly Strategic ETF Trust Kelly Residential & Apartment Real Estate ETF,RESI,N
RESP,Y,"",P, ,RESP,Y,N,100,WisdomTree U.S. ESG Fund,RESP,N
"",N,N,Q,G,RETA,Y,N,100,"Reata Pharmaceuticals, Inc. - Class A Common Stock",RETA,N
RETL,Y,"",P, ,RETL,Y,N,100,Direxion Daily Retail Bull 3X Shares ETF,RETL,N
"",N,D,Q,S,RETO,Y,N,100,"ReTo Eco-Solutions, Inc. - Common Shares",RETO,N
"",N,N,Q,Q,REUN,Y,N,100,Reunion Neuroscience Inc. - Common Shares,REUN,N
"",N,D,Q,S,REVB,Y,N,100,"Revelation Biosciences, Inc. - Common Stock",REVB,N
"",N,N,Q,S,REVBU,Y,N,100,"Revelation Biosciences, Inc. - Unit",REVBU,N
"",N,D,Q,S,REVBW,Y,N,100,"Revelation Biosciences, Inc. - Warrant",REVBW,N
"",N,N,Q,S,REVE,Y,N,100,Alpine Acquisition Corporation - Common Stock,REVE,N
"",N,N,Q,S,REVEU,Y,N,100,Alpine Acquisition Corporation - Unit,REVEU,N
"",N,N,Q,S,REVEW,Y,N,100,Alpine Acquisition Corporation - Warrant,REVEW,N
REVG,N,"",N, ,REVG,Y,N,100,"REV Group, Inc. Common Stock",REVG,N
REVS,Y,"",P, ,REVS,Y,N,100,Columbia Research Enhanced Value ETF,REVS,N
REW,Y,"",P, ,REW,Y,N,100,ProShares UltraShort Technology,REW,N
REX,N,"",N, ,REX,Y,N,100,REX American Resources Corporation,REX,N
REXR,N,"",N, ,REXR,Y,N,100,"Rexford Industrial Realty, Inc. Common Stock",REXR,N
REXRpB,N,"",N, ,REXR-B,Y,N,100,"Rexford Industrial Realty, Inc. 5.875% Series B Cumulative Redeemable Preferred Stock",REXR$B,N
REXRpC,N,"",N, ,REXR-C,Y,N,100,"Rexford Industrial Realty, Inc. 5.625% Series C Cumulative Redeemable Preferred Stock, par value $0.01 per share",REXR$C,N
"",N,N,Q,Q,REYN,Y,N,100,Reynolds Consumer Products Inc. - Common Stock,REYN,N
REZ,Y,"",P, ,REZ,Y,N,100,iShares Residential and Multisector Real Estate ETF,REZ,N
REZI,N,"",N, ,REZI,Y,N,100,"Resideo Technologies, Inc. Common Stock ",REZI,N
RF,N,"",N, ,RF,Y,N,100,Regions Financial Corporation Common Stock,RF,N
RFpB,N,"",N, ,RF-B,Y,N,100,Regions Financial Corporation Depositary Shares Representing 1/40th Perpetual Preferred Series B,RF$B,N
RFpC,N,"",N, ,RF-C,Y,N,100,"Regions Financial Corporation Depositary Shares, each Representing a 1/40th Interest in a  Share of 5.700% Fixed-to-Floating Rate Non-Cumulative  Perpetual Preferred Stock, Series C",RF$C,N
RFpE,N,"",N, ,RF-E,Y,N,100,"Regions Financial Corporation Depositary Shares, Each Representing a 1/40th Interest in a Share of 4.45% Non-Cumulative Perpetual Preferred Stock, Series E",RF$E,N
"",N,N,Q,G,RFAC,Y,N,100,RF Acquisition Corp. - Class A Common Stock,RFAC,N
"",N,N,Q,G,RFACR,Y,N,100,RF Acquisition Corp. - Rights,RFACR,N
"",N,N,Q,G,RFACU,Y,N,100,RF Acquisition Corp. - Unit,RFACU,N
"",N,N,Q,G,RFACW,Y,N,100,RF Acquisition Corp. - Warrants,RFACW,N
RFCI,Y,"",P, ,RFCI,Y,N,100,RiverFront Dynamic Core Income ETF,RFCI,N
RFDA,Y,"",P, ,RFDA,Y,N,100,RiverFront Dynamic US Dividend Advantage ETF,RFDA,N
"",Y,N,Q,G,RFDI,Y,N,100,First Trust RiverFront Dynamic Developed International ETF,RFDI,N
"",Y,N,Q,G,RFEM,Y,N,100,First Trust RiverFront Dynamic Emerging Markets ETF,RFEM,N
"",Y,N,Q,G,RFEU,Y,N,100,First Trust RiverFront Dynamic Europe ETF,RFEU,N
RFFC,Y,"",P, ,RFFC,Y,N,100,RiverFront Dynamic US Flex-Cap ETF,RFFC,N
RFG,Y,"",P, ,RFG,Y,N,100,Invesco S&P Midcap 400 Pure Growth ETF,RFG,N
RFI,N,"",N, ,RFI,Y,N,100,"Cohen & Steers Total Return Realty Fund, Inc. Common Stock",RFI,N
"",N,N,Q,G,RFIL,Y,N,100,"RF Industries, Ltd. - Common Stock",RFIL,N
RFL,N,"",N, ,RFL,Y,N,100,"Rafael Holdings, Inc. Class B Common Stock",RFL,N
RFM,N,"",N, ,RFM,Y,N,100,"RiverNorth Flexible Municipal Income Fund, Inc. Common Stock",RFM,N
RFMZ,N,"",N, ,RFMZ,Y,N,100,"RiverNorth Flexible Municipal Income Fund II, Inc. Common Stock",RFMZ,N
RFP,N,"",N, ,RFP,Y,N,100,Resolute Forest Products Inc. Common Stock,RFP,N
RFV,Y,"",P, ,RFV,Y,N,100,Invesco S&P Midcap 400 Pure Value ETF,RFV,N
RGA,N,"",N, ,RGA,Y,N,100,"Reinsurance Group of America, Incorporated Common Stock",RGA,N
"",N,N,Q,S,RGC,Y,N,100,Regencell Bioscience Holdings Limited - Ordinary Shares,RGC,N
"",N,N,Q,G,RGCO,Y,N,100,RGC Resources Inc. - Common Stock,RGCO,N
"",N,N,Q,Q,RGEN,Y,N,100,Repligen Corporation - Common Stock,RGEN,N
"",N,D,Q,G,RGF,Y,N,100,"The Real Good Food Company, Inc. - Class A Common Stock",RGF,N
RGI,Y,"",P, ,RGI,Y,N,100,Invesco S&P 500 Equal Weight Industrials Portfolio,RGI,N
"",N,N,Q,Q,RGLD,Y,N,100,"Royal Gold, Inc. - Common Stock",RGLD,N
"",N,N,Q,S,RGLS,Y,N,100,Regulus Therapeutics Inc. - Common Stock,RGLS,N
"",N,N,Q,Q,RGNX,Y,N,100,REGENXBIO Inc. - Common Stock,RGNX,N
"",N,N,Q,Q,RGP,Y,N,100,"Resources Connection, Inc. - Common Stock",RGP,N
RGR,N,"",N, ,RGR,Y,N,100,"Sturm, Ruger & Company, Inc. Common Stock",RGR,N
RGS,N,"",N, ,RGS,Y,N,100,Regis Corporation Common Stock,RGS,N
RGT,N,"",N, ,RGT,Y,N,100,"Royce Global Value Trust, Inc. Common Stock",RGT,N
"",N,N,Q,S,RGTI,Y,N,100,"Rigetti Computing, Inc.  - Common stock",RGTI,N
"",N,N,Q,S,RGTIW,Y,N,100,"Rigetti Computing, Inc.  - Redeemable warrants, each whole warrant exercisable for one Class A ordinary share at an exercise price of $11.50",RGTIW,N
RH,N,"",N, ,RH,Y,N,100,RH Common Stock,RH,N
RHCB,Y,"",P, ,RHCB,Y,N,100,BNY Mellon ETF Trust BNY Mellon Responsible Horizons Corporate Bond ETF,RHCB,N
RHE,N,"",A, ,RHE,Y,N,100,"Regional Health Properties, Inc. Common Stock",RHE,N
RHEpA,N,"",A, ,RHE-A,Y,N,100,"Regional Health Properties, Inc. 10.875% Series A Cumulative Redeemable Preferred Stock",RHE$A,N
RHI,N,"",N, ,RHI,Y,N,100,Robert Half International Inc. Common Stock,RHI,N
RHP,N,"",N, ,RHP,Y,N,100,"Ryman Hospitality Properties, Inc. (REIT)",RHP,N
RHRX,Y,"",P, ,RHRX,Y,N,100,RH Tactical Rotation ETF,RHRX,N
RHS,Y,"",P, ,RHS,Y,N,100,Invesco S&P 500 Equal Weight Consumer Staples ETF  ,RHS,N
RHTX,Y,"",P, ,RHTX,Y,N,100,RH Tactical Outlook ETF,RHTX,N
"",N,N,Q,S,RIBT,Y,N,100,RiceBran Technologies - Common Stock,RIBT,N
"",N,N,Q,G,RICK,Y,N,100,"RCI Hospitality Holdings, Inc. - Common Stock",RICK,N
"",N,N,Q,Q,RIDE,Y,N,100,Lordstown Motors Corp. - Class A Common Stock,RIDE,N
RIET,Y,"",P, ,RIET,Y,N,100,Hoya Capital High Dividend Yield ETF,RIET,N
RIG,N,"",N, ,RIG,Y,N,100,Transocean Ltd (Switzerland) Common Stock,RIG,N
"",N,N,Q,Q,RIGL,Y,N,100,"Rigel Pharmaceuticals, Inc. - Common Stock",RIGL,N
RIGS,Y,"",P, ,RIGS,Y,N,100,RiverFront Strategic Income Fund,RIGS,N
"",N,N,Q,G,RILY,Y,N,100,"B. Riley Financial, Inc. - Common Stock",RILY,N
"",N,N,Q,G,RILYG,Y,N,100,"B. Riley Financial, Inc. - 5.00% Senior Notes due 2026",RILYG,N
"",N,N,Q,G,RILYK,Y,N,100,"B. Riley Financial, Inc. - 5.50% Senior Notes Due 2026",RILYK,N
"",N,N,Q,G,RILYL,Y,N,100,"B. Riley Financial, Inc. - Depositary Shares, each representing a 1/1000th fractional interest in a share of Series B Cumulative Perpetual Preferred Stock",RILYL,N
"",N,N,Q,G,RILYM,Y,N,100,"B. Riley Financial, Inc. - 6.375% Senior Notes due 2025",RILYM,N
"",N,N,Q,G,RILYN,Y,N,100,"B. Riley Financial, Inc. - 6.50% Senior Notes Due 2026",RILYN,N
"",N,N,Q,G,RILYO,Y,N,100,"B. Riley Financial, Inc. - 6.75% Senior Notes due 2024",RILYO,N
"",N,N,Q,G,RILYP,Y,N,100,"B. Riley Financial, Inc. - Depositary Shares, each representing a 1/1000th fractional interest in a share of Series A Cumulative Perpetual Preferred Stock",RILYP,N
"",N,N,Q,G,RILYT,Y,N,100,"B. Riley Financial, Inc. - 6.00% Senior Notes Due 2028",RILYT,N
"",N,N,Q,G,RILYZ,Y,N,100,"B. Riley Financial, Inc. - 5.25% Senior Notes due 2028",RILYZ,N
RINF,Y,"",P, ,RINF,Y,N,100,ProShares Inflation Expectations ETF,RINF,N
"",Y,N,Q,G,RING,Y,N,100,iShares MSCI Global Gold Miners ETF,RING,N
RIO,N,"",N, ,RIO,Y,N,100,Rio Tinto Plc Common Stock,RIO,N
"",N,N,Q,S,RIOT,Y,N,100,"Riot Platforms, Inc. - Common Stock",RIOT,N
RISN,Y,"",P, ,RISN,Y,N,100,Inspire Tactical Balanced ETF,RISN,N
RISR,Y,"",P, ,RISR,Y,N,100,FolioBeyond Rising Rates ETF,RISR,N
RITA,Y,"",P, ,RITA,Y,N,100,ETF Series Solutions ETFB Green SRI REITs ETF,RITA,N
RITM,N,"",N, ,RITM,Y,N,100,Rithm Capital Corp. Common Stock,RITM,N
RITMpA,N,"",N, ,RITM-A,Y,N,100,Rithm Capital Corp. 7.50% Series A Fixed-to-Floating Rate Cumulative Redeemable Preferred Stock,RITM$A,N
RITMpB,N,"",N, ,RITM-B,Y,N,100,Rithm Capital Corp. 7.125% Series B Fixed-to-Floating Rate Cumulative Redeemable Preferred Stock,RITM$B,N
RITMpC,N,"",N, ,RITM-C,Y,N,100,Rithm Capital Corp. 6.375% Series C Fixed-to-Floating Rate Cumulative Redeemable Preferred Stock,RITM$C,N
RITMpD,N,"",N, ,RITM-D,Y,N,100,Rithm Capital Corp. 7.00% Fixed-Rate Reset Series D Cumulative Redeemable Preferred Stock,RITM$D,N
RIV,N,"",N, ,RIV,Y,N,100,"RiverNorth Opportunities Fund, Inc. Common Stock",RIV,N
RIVpA,N,"",N, ,RIV-A,Y,N,100,"RiverNorth Opportunities Fund, Inc. 6.00% Series A Perpetual Preferred Stock",RIV$A,N
"",N,N,Q,Q,RIVN,Y,N,100,"Rivian Automotive, Inc. - Class A Common Stock",RIVN,N
RJAC,N,"",N, ,RJAC,Y,N,100,Jackson Acquisition Company Class A Common Stock,RJAC,N
RJAC.U,N,"",N, ,RJAC=,Y,N,100,"Jackson Acquisition Company Units, each consisting of one share of Class A common stock and one-half of one redeemable warrant",RJAC.U,N
RJF,N,"",N, ,RJF,Y,N,100,"Raymond James Financial, Inc. Common Stock",RJF,N
RJFpA,N,"",N, ,RJF-A,Y,N,100,"Raymond James Financial, Inc. Depositary Shares, each representing a 1/40th interest in a share of 6.75% Fixed-to-Floating Rate Series A Non-Cumulative Perpetual Preferred Stock",RJF$A,N
RJFpB,N,"",N, ,RJF-B,Y,N,100,"Raymond James Financial, Inc. Depositary Shares, each representing a 1/40th interest in a share of 6.375% Fixed-to-Floating Rate Series B Non-Cumulative Perpetual Preferred Stock",RJF$B,N
"",N,D,Q,S,RKDA,Y,N,100,"Arcadia Biosciences, Inc. - Common Stock",RKDA,N
"",N,N,Q,S,RKLB,Y,N,100,"Rocket Lab USA, Inc. - Common Stock",RKLB,N
RKLY,N,"",N, ,RKLY,Y,N,100,Rockley Photonics Holdings Limited Ordinary Shares,RKLY,N
RKLY.WS,N,"",N, ,RKLY+,Y,N,100,"Rockley Photonics Holdings Limited Warrants, each warrant exercisable for one ordinary share at an exercise price of $11.50",RKLY.W,N
RKT,N,"",N, ,RKT,Y,N,100,"Rocket Companies, Inc. Class A Common Stock",RKT,N
RKTA,N,"",N, ,RKTA,Y,N,100,Rocket Internet Growth Opportunities Corp. Class A Ordinary Shares,RKTA,N
RKTA.U,N,"",N, ,RKTA=,Y,N,100,"Rocket Internet Growth Opportunities Corp. Units, each consisting of one Class A ordinary share and one-fourth of one redeemable warrant",RKTA.U,N
RL,N,"",N, ,RL,Y,N,100,Ralph Lauren Corporation Common Stock,RL,N
"",N,N,Q,G,RLAY,Y,N,100,"Relay Therapeutics, Inc. - Common Stock",RLAY,N
RLGT,N,"",A, ,RLGT,Y,N,100,"Radiant Logistics, Inc. Common Stock",RLGT,N
RLI,N,"",N, ,RLI,Y,N,100,RLI Corp. Common Stock (DE),RLI,N
RLJ,N,"",N, ,RLJ,Y,N,100,RLJ Lodging Trust Common Shares of Beneficial Interest $0.01 par value,RLJ,N
RLJpA,N,"",N, ,RLJ-A,Y,N,100,RLJ Lodging Trust $1.95 Series A Cumulative Convertible  Preferred Shares,RLJ$A,N
"",N,N,Q,Q,RLMD,Y,N,100,"Relmada Therapeutics, Inc. - Common Stock",RLMD,N
RLTY,N,"",N, ,RLTY,Y,N,100,Cohen & Steers Real Estate Opportunities and Income Fund Common Shares of Beneficial Interest,RLTY,N
RLX,N,"",N, ,RLX,Y,N,100,"RLX Technology Inc. American Depositary Shares, each representing the right to receive one (1) Class A ordinary share",RLX,N
RLY,Y,"",P, ,RLY,Y,N,100,SPDR SSgA Multi Asset Real Return ETF,RLY,N
"",N,N,Q,Q,RLYB,Y,N,100,Rallybio Corporation - Common Stock,RLYB,N
RM,N,"",N, ,RM,Y,N,100,Regional Management Corp. Common Stock,RM,N
RMAX,N,"",N, ,RMAX,Y,N,100,"RE/MAX Holdings, Inc. Class A Common Stock",RMAX,N
"",N,N,Q,S,RMBI,Y,N,100,"Richmond Mutual Bancorporation, Inc. - Common Stock",RMBI,N
"",N,N,Q,S,RMBL,Y,N,100,"RumbleOn, Inc. - Class B Common Stock",RMBL,N
"",N,N,Q,Q,RMBS,Y,N,100,"Rambus, Inc. - Common Stock",RMBS,N
"",N,N,Q,G,RMCF,Y,N,100,"Rocky Mountain Chocolate Factory, Inc. - Common Stock",RMCF,N
RMD,N,"",N, ,RMD,Y,N,100,ResMed Inc. Common Stock,RMD,N
RMED,N,"",A, ,RMED,Y,N,100,"Ra Medical Systems, Inc. Common Stock",RMED,N
"",N,D,Q,S,RMGC,Y,N,100,RMG Acquisition Corp. III - Class A Ordinary Shares,RMGC,N
"",N,D,Q,S,RMGCU,Y,N,100,RMG Acquisition Corp. III - Unit,RMGCU,N
"",N,D,Q,S,RMGCW,Y,N,100,RMG Acquisition Corp. III - Warrant,RMGCW,N
RMI,N,"",N, ,RMI,Y,N,100,"RiverNorth Opportunistic Municipal Income Fund, Inc. Common Stock",RMI,N
RMM,N,"",N, ,RMM,Y,N,100,"RiverNorth Managed Duration Municipal Income Fund, Inc. Common Stock",RMM,N
RMMZ,N,"",N, ,RMMZ,Y,N,100,"RiverNorth Managed Duration Municipal Income Fund II, Inc. Common Stock",RMMZ,N
"",N,N,Q,G,RMNI,Y,N,100,"Rimini Street, Inc. - Common Stock",RMNI,N
RMPLp,N,"",N, ,RMPL-,Y,N,100,RiverNorth Capital and Income Fund 5.875%% Series A Term Preferred Stock $0.0001 par value per share,RMPL$,N
"",N,N,Q,S,RMR,Y,N,100,The RMR Group Inc. - Class A Common Stock,RMR,N
RMT,N,"",N, ,RMT,Y,N,100,"Royce Micro-Cap Trust, Inc. Common Stock",RMT,N
"",N,N,Q,S,RMTI,Y,N,100,"Rockwell Medical, Inc. - Common Stock",RMTI,N
"",N,N,Q,G,RNA,Y,N,100,"Avidity Biosciences, Inc. - Common Stock",RNA,N
"",N,D,Q,S,RNAZ,Y,N,100,"TransCode Therapeutics, Inc. - Common Stock",RNAZ,N
"",Y,N,Q,G,RNDM,Y,N,100,Developed International Equity Select ETF,RNDM,N
"",Y,N,Q,G,RNDV,Y,N,100,US Equity Dividend Select ETF,RNDV,N
"",Y,N,Q,G,RNEM,Y,N,100,Emerging Markets Equity Select ETF,RNEM,N
"",N,N,Q,G,RNER,Y,N,100,Mount Rainier Acquisition Corp. - Common Stock,RNER,N
"",N,N,Q,G,RNERU,Y,N,100,Mount Rainier Acquisition Corp. - Unit,RNERU,N
"",N,N,Q,G,RNERW,Y,N,100,Mount Rainier Acquisition Corp. - Warrant,RNERW,N
"",Y,N,Q,G,RNEW,Y,N,100,VanEck Green Infrastructure ETF,RNEW,N
RNG,N,"",N, ,RNG,Y,N,100,"RingCentral, Inc. Class A Common Stock",RNG,N
RNGR,N,"",N, ,RNGR,Y,N,100,"Ranger Energy Services, Inc. Class A Common Stock",RNGR,N
"",Y,N,Q,G,RNLC,Y,N,100,Large Cap US Equity Select ETF,RNLC,N
"",N,N,Q,G,RNLX,Y,N,100,Renalytix plc - American Depositary Shares,RNLX,N
"",Y,N,Q,G,RNMC,Y,N,100,Mid Cap US Equity Select ETF,RNMC,N
RNP,N,"",N, ,RNP,Y,N,100,"Cohen & Steers REIT and Preferred and Income Fund, Inc. Common Shares",RNP,N
RNR,N,"",N, ,RNR,Y,N,100,RenaissanceRe Holdings Ltd. Common Stock,RNR,N
RNRpF,N,"",N, ,RNR-F,Y,N,100,"RenaissanceRe Holdings Ltd. Depositary Shares, each Representing a 1/1,000th Interest in a 5.750% Series F Preference Share",RNR$F,N
RNRpG,N,"",N, ,RNR-G,Y,N,100,"RenaissanceRe Holdings Ltd. Depositary Shares, each representing a 1/1,000th interest in a share of 4.20% Series G Preference Shares",RNR$G,N
"",Y,N,Q,G,RNRG,Y,N,100,Global X Renewable Energy Producers ETF,RNRG,N
"",Y,N,Q,G,RNSC,Y,N,100,Small Cap US Equity Select ETF,RNSC,N
"",N,N,Q,Q,RNST,Y,N,100,Renasant Corporation - Common Stock,RNST,N
"",N,N,Q,Q,RNW,Y,N,100,ReNew Energy Global plc - Class A Shares,RNW,N
"",N,N,Q,Q,RNWWW,Y,N,100,ReNew Energy Global plc - Warrant,RNWWW,N
RNWZ,Y,"",P, ,RNWZ,Y,N,100,Listed Funds Trust TrueShares Eagle Global Renewable Energy Income ETF,RNWZ,N
"",N,N,Q,S,RNXT,Y,N,100,"RenovoRx, Inc. - Common Stock",RNXT,N
"",N,N,Q,Q,ROAD,Y,N,100,"Construction Partners, Inc. - Common Stock",ROAD,N
ROAM,Y,"",P, ,ROAM,Y,N,100,Hartford Multifactor Emerging Markets ETF,ROAM,N
ROBO,Y,"",P, ,ROBO,Y,N,100,Exchange Traded Concepts Trust ROBO Global Robotics and Automation Index ETF,ROBO,N
"",Y,N,Q,G,ROBT,Y,N,100,First Trust Nasdaq Artificial Intelligence and Robotics ETF,ROBT,N
"",N,N,Q,G,ROC,Y,N,100,ROC Energy Acquisition Corp. - Common Stock,ROC,N
"",N,N,Q,G,ROCAR,Y,N,100,ROC Energy Acquisition Corp. - Rights,ROCAR,N
"",N,N,Q,G,ROCAU,Y,N,100,ROC Energy Acquisition Corp. - Unit,ROCAU,N
"",N,N,Q,Q,ROCC,Y,N,100,Ranger Oil Corporation - Class A Common Stock,ROCC,N
"",N,N,Q,S,ROCG,Y,N,100,Roth CH Acquisition IV Co. - Common Stock,ROCG,N
"",N,N,Q,S,ROCGU,Y,N,100,Roth CH Acquisition IV Co. - Unit,ROCGU,N
"",N,N,Q,S,ROCGW,Y,N,100,Roth CH Acquisition IV Co. - Warrant,ROCGW,N
ROCI,Y,"",Z, ,ROCI,Y,N,100,Alpha Architect ETF Trust ROC ETF,ROCI,N
"",N,N,Q,Q,ROCK,Y,N,100,"Gibraltar Industries, Inc. - Common Stock",ROCK,N
"",N,N,Q,G,ROCL,Y,N,100,Roth CH Acquisition V Co. - Common Stock,ROCL,N
"",N,N,Q,G,ROCLU,Y,N,100,Roth CH Acquisition V Co. - Unit,ROCLU,N
"",N,N,Q,G,ROCLW,Y,N,100,Roth CH Acquisition V Co. - Warrant,ROCLW,N
RODE,Y,"",Z, ,RODE,Y,N,100,Hartford Multifactor Diversified International ETF,RODE,N
RODM,Y,"",P, ,RODM,Y,N,100,Hartford Multifactor Developed Markets (ex-US) ETF,RODM,N
ROG,N,"",N, ,ROG,Y,N,100,Rogers Corporation Common Stock,ROG,N
"",N,N,Q,Q,ROIC,Y,N,100,Retail Opportunity Investments Corp. - Common Stock,ROIC,N
"",N,N,Q,G,ROIV,Y,N,100,Roivant Sciences Ltd. - Common Shares,ROIV,N
"",N,N,Q,G,ROIVW,Y,N,100,Roivant Sciences Ltd. - Warrant,ROIVW,N
ROK,N,"",N, ,ROK,Y,N,100,"Rockwell Automation, Inc. Common Stock",ROK,N
ROKT,Y,"",P, ,ROKT,Y,N,100,SPDR S&P Kensho Final Frontiers ETF,ROKT,N
"",N,N,Q,Q,ROKU,Y,N,100,"Roku, Inc. - Class A Common Stock",ROKU,N
ROL,N,"",N, ,ROL,Y,N,100,"Rollins, Inc. Common Stock",ROL,N
ROM,Y,"",P, ,ROM,Y,N,100,ProShares Ultra Technology,ROM,N
ROMO,Y,"",Z, ,ROMO,Y,N,100,Strategy Shares Newfound/ReSolve Robust Momentum ETF,ROMO,N
RONI,N,"",N, ,RONI,Y,N,100,Rice Acquisition Corp. II Class A Ordinary Shares,RONI,N
RONI.U,N,"",N, ,RONI=,Y,N,100,"Rice Acquisition Corp. II Units, each consisting of one Class A ordinary share and one-fourth of one redeemable warrant",RONI.U,N
RONI.WS,N,"",N, ,RONI+,Y,N,100,"Rice Acquisition Corp. II Redeemable warrants, each whole warrant exercisable for one Class A ordinary share at an exercise price of $11.50",RONI.W,N
ROOF,Y,"",P, ,ROOF,Y,N,100,IQ CBRE NextGen Real Estate ETF,ROOF,N
"",N,N,Q,Q,ROOT,Y,N,100,"Root, Inc. - Common Stock",ROOT,N
ROP,N,"",N, ,ROP,Y,N,100,"Roper Technologies, Inc. Common Stock",ROP,N
RORO,Y,"",P, ,RORO,Y,N,100,ATAC US Rotation ETF,RORO,N
ROSC,Y,"",P, ,ROSC,Y,N,100,Hartford Multifactor Small Cap ETF,ROSC,N
"",N,N,Q,G,ROSE,Y,N,100,Rose Hill Acquisition Corporation - Class A Ordinary Shares,ROSE,N
"",N,N,Q,G,ROSEU,Y,N,100,Rose Hill Acquisition Corporation - Unit,ROSEU,N
"",N,N,Q,G,ROSEW,Y,N,100,Rose Hill Acquisition Corporation - Warrant,ROSEW,N
ROSS,N,"",N, ,ROSS,Y,N,100,Ross Acquisition Corp II Class A Ordinary Shares,ROSS,N
ROSS.U,N,"",N, ,ROSS=,Y,N,100,Ross Acquisition Corp II Units,ROSS.U,N
ROSS.WS,N,"",N, ,ROSS+,Y,N,100,"Ross Acquisition Corp II Warrants, each whole warrant exercisable for one Class A ordinary share at an exercise price of $11.50 per share",ROSS.W,N
"",N,N,Q,Q,ROST,Y,N,100,"Ross Stores, Inc. - Common Stock",ROST,N
ROUS,Y,"",P, ,ROUS,Y,N,100,Hartford Multifactor U.S. Equity ETF,ROUS,N
"",N,N,Q,G,ROVR,Y,N,100,"Rover Group, Inc. - Class A Common Stock",ROVR,N
RPAR,Y,"",P, ,RPAR,Y,N,100,RPAR Risk Parity ETF,RPAR,N
"",N,N,Q,S,RPAY,Y,N,100,Repay Holdings Corporation - Class A Common Stock,RPAY,N
"",N,N,Q,G,RPD,Y,N,100,"Rapid7, Inc. - Common Stock",RPD,N
RPG,Y,"",P, ,RPG,Y,N,100,Invesco S&P 500 Pure Growth ETF,RPG,N
"",N,N,Q,G,RPHM,Y,N,100,"Reneo Pharmaceuticals, Inc. - Common Stock",RPHM,N
RPHS,Y,"",Z, ,RPHS,Y,N,100,Two Roads Shared Trust Regents Park Hedged Market Strategy ETF,RPHS,N
"",N,N,Q,Q,RPID,Y,N,100,"Rapid Micro Biosystems, Inc. - Class A Common Stock",RPID,N
RPM,N,"",N, ,RPM,Y,N,100,RPM International Inc. Common Stock,RPM,N
"",N,N,Q,Q,RPRX,Y,N,100,Royalty Pharma plc - Class A Ordinary Shares,RPRX,N
RPT,N,"",N, ,RPT,Y,N,100,RPT Realty Common Stock,RPT,N
RPTpD,N,"",N, ,RPT-D,Y,N,100,RPT Realty 7.25% ,RPT$D,N
"",N,N,Q,Q,RPTX,Y,N,100,Repare Therapeutics Inc. - Common Shares,RPTX,N
RPV,Y,"",P, ,RPV,Y,N,100,Invesco S&P 500 Pure Value ETF,RPV,N
RQI,N,"",N, ,RQI,Y,N,100,Cohen & Steers Quality Income Realty Fund Inc Common Shares,RQI,N
RRAC,N,"",N, ,RRAC,Y,N,100,Rigel Resource Acquisition Corp. Class A Ordinary Shares,RRAC,N
RRAC.U,N,"",N, ,RRAC=,Y,N,100,"Rigel Resource Acquisition Corp. Units, each consisting of one Class A ordinary share and one-half of one redeemable warrant",RRAC.U,N
RRAC.WS,N,"",N, ,RRAC+,Y,N,100,"Rigel Resource Acquisition Corp. Warrants, each whole warrant exercisable for one Class A ordinary share at an exercise price of $11.50 per share",RRAC.W,N
"",N,N,Q,Q,RRBI,Y,N,100,"Red River Bancshares, Inc. - Common Stock",RRBI,N
RRC,N,"",N, ,RRC,Y,N,100,Range Resources Corporation Common Stock,RRC,N
"",N,N,Q,Q,RRGB,Y,N,100,"Red Robin Gourmet Burgers, Inc. - Common Stock",RRGB,N
RRH,Y,"",P, ,RRH,Y,N,100,Advocate Rising Rate Hedge ETF,RRH,N
"",N,N,Q,Q,RRR,Y,N,100,"Red Rock Resorts, Inc. - Class A Common Stock",RRR,N
RRX,N,"",N, ,RRX,Y,N,100,Regal Rexnord Corporation Common Stock,RRX,N
RS,N,"",N, ,RS,Y,N,100,Reliance Steel & Aluminum Co. Common Stock (DE),RS,N
RSEE,Y,"",Z, ,RSEE,Y,N,100,Collaborative Investment Series Trust Rareview Systematic Equity ETF,RSEE,N
RSF,N,"",N, ,RSF,Y,N,100,RiverNorth Capital and Income Fund Common Stock,RSF,N
RSFr,N,"",N, ,RSF^,Y,N,100,"RiverNorth Capital and Income Fund Rights (expiring January 27, 2023) Rights",RSF.R,N
RSG,N,"",N, ,RSG,Y,N,100,"Republic Services, Inc. Common Stock",RSG,N
RSI,N,"",N, ,RSI,Y,N,100,"Rush Street Interactive, Inc. Class A Common Stock",RSI,N
RSKD,N,"",N, ,RSKD,Y,N,100,Riskified Ltd. Class A Ordinary Shares,RSKD,N
"",N,D,Q,S,RSLS,Y,N,100,"ReShape Lifesciences, Inc. - Common Stock",RSLS,N
RSP,Y,"",P, ,RSP,Y,N,100,Invesco S&P 500 Equal Weight ETF,RSP,N
RSPE,Y,"",P, ,RSPE,Y,N,100,Invesco ESG S&P 500 Equal Weight ETF,RSPE,N
RSPY,Y,"",P, ,RSPY,Y,N,100,Revere Sector Opportunity ETF,RSPY,N
"",N,N,Q,S,RSSS,Y,N,100,"Research Solutions, Inc - Common Stock",RSSS,N
"",N,N,Q,G,RSVR,Y,N,100,"Reservoir Media, Inc.. - Common Stock",RSVR,N
"",N,N,Q,G,RSVRW,Y,N,100,"Reservoir Media, Inc.. - Warrant",RSVRW,N
RSX,Y,"",Z, ,RSX,Y,N,100,VanEck Russia ETF,RSX,N
RSXJ,Y,"",Z, ,RSXJ,Y,N,100,VanEck Russia Small-Cap ETF,RSXJ,N
RTAI,Y,"",Z, ,RTAI,Y,N,100,Rareview Tax Advantaged Income ETF,RTAI,N
"",N,N,Q,S,RTC,Y,N,100,Baijiayun Group Ltd - Class Ordinary Shares,RTC,N
"",Y,N,Q,G,RTH,Y,N,100,VanEck Retail ETF,RTH,N
"",N,N,Q,Q,RTL,Y,N,100,"The Necessity Retail REIT, Inc. - Class A Common Stock",RTL,N
"",N,N,Q,Q,RTLPO,Y,N,100,"The Necessity Retail REIT, Inc. - 7.375% Series C Cumulative Redeemable Preferred Stock",RTLPO,N
"",N,N,Q,Q,RTLPP,Y,N,100,"The Necessity Retail REIT, Inc. - 7.50% Series A Cumulative Redeemable Perpetual Preferred Stock",RTLPP,N
RTM,Y,"",P, ,RTM,Y,N,100,Invesco S&P 500 Equal Weight Materials ETF,RTM,N
RTO,N,"",N, ,RTO,Y,N,100,Rentokil Initial plc American Depositary Shares (each representing five (5) Ordinary Shares),RTO,N
RTX,N,"",N, ,RTX,Y,N,100,Raytheon Technologies Corporation Common Stock,RTX,N
RTYD,Y,"",P, ,RTYD,Y,N,100,Simplify Exchange Traded Funds Simplify US Small Cap PLUS Downside Convexity ETF,RTYD,N
"",N,D,Q,Q,RUBY,Y,N,100,"Rubius Therapeutics, Inc. - Common Stock",RUBY,N
RUFF,Y,"",P, ,RUFF,Y,N,100,Alpha Dog ETF,RUFF,N
RULE,Y,"",Z, ,RULE,Y,N,100,Adaptive Core ETF,RULE,N
"",N,N,Q,G,RUM,Y,N,100,Rumble Inc. - Class A Common Stock,RUM,N
"",N,N,Q,G,RUMBW,Y,N,100,Rumble Inc. - Warrant,RUMBW,N
"",N,N,Q,Q,RUN,Y,N,100,Sunrun Inc. - Common Stock,RUN,N
"",N,N,Q,Q,RUSHA,Y,N,100,"Rush Enterprises, Inc. - Class A Common Stock",RUSHA,N
"",N,N,Q,Q,RUSHB,Y,N,100,"Rush Enterprises, Inc. - Class B Common Stock",RUSHB,N
"",N,N,Q,Q,RUTH,Y,N,100,"Ruth's Hospitality Group, Inc. - Common Stock",RUTH,N
"",N,N,Q,Q,RVLP,Y,N,100,RVL Pharmaceuticals plc - Ordinary Shares,RVLP,N
RVLV,N,"",N, ,RVLV,Y,N,100,"Revolve Group, Inc. Class A Common Stock",RVLV,N
"",N,N,Q,Q,RVMD,Y,N,100,"Revolution Medicines, Inc. - Common Stock",RVMD,N
