CQS Symbol,ETF,Financial Status,Listing Exchange,Market Category,NASDAQ Symbol,Nasdaq Traded,NextShares,Round Lot Size,Security Name,Symbol,Test Issue
"",N,N,Q,Q,IRTC,Y,N,100,"iRhythm Technologies, Inc. - Common Stock",IRTC,N
IRVH,Y,"",P, ,IRVH,Y,N,100,Global X Funds Global X Interest Rate Volatility & Inflation Hedge ETF,IRVH,N
"",N,N,Q,Q,IRWD,Y,N,100,"Ironwood Pharmaceuticals, Inc. - Class A Common Stock",IRWD,N
ISCB,Y,"",P, ,ISCB,Y,N,100,iShares Morningstar Small-Cap ETF,ISCB,N
ISCF,Y,"",P, ,ISCF,Y,N,100,iShares MSCI Intl Small-Cap Multifactor ETF,ISCF,N
ISCG,Y,"",P, ,ISCG,Y,N,100,iShares Morningstar Small-Cap Growth ETF,ISCG,N
ISCV,Y,"",P, ,ISCV,Y,N,100,iShares Morningstar Small-Cap Value ETF,ISCV,N
ISD,N,"",N, ,ISD,Y,N,100,"PGIM High Yield Bond Fund, Inc.",ISD,N
ISDB,Y,"",Z, ,ISDB,Y,N,100,Invesco Actively Managed Exchange-Traded Fund Trus Invesco Short Duration Bond ETF,ISDB,N
ISDR,N,"",A, ,ISDR,Y,N,100,Issuer Direct Corporation Common Stock,ISDR,N
"",Y,N,Q,G,ISDX,Y,N,100,Invesco RAFI Strategic Developed ex-US ETF,ISDX,N
"",N,N,Q,Q,ISEE,Y,N,100,"IVERIC bio, Inc. - Common Stock",ISEE,N
"",Y,N,Q,G,ISEM,Y,N,100,Invesco RAFI Strategic Emerging Markets ETF,ISEM,N
"",Y,N,Q,G,ISHG,Y,N,100,iShares 1-3 Year International Treasury Bond ETF,ISHG,N
"",Y,N,Q,G,ISHP,Y,N,100,First Trust S-Network E-Commerce ETF,ISHP,N
"",N,N,Q,S,ISIG,Y,N,100,"Insignia Systems, Inc. - Common Stock",ISIG,N
ISMD,Y,"",P, ,ISMD,Y,N,100,Inspire Small/Mid Cap ETF,ISMD,N
"",N,N,Q,Q,ISO,Y,N,100,IsoPlexis Corporation - common stock,ISO,N
"",N,N,Q,S,ISPC,Y,N,100,iSpecimen Inc. - Common Stock,ISPC,N
"",N,N,Q,G,ISPO,Y,N,100,Inspirato Incorporated - Class A Common Stock,ISPO,N
"",N,N,Q,G,ISPOW,Y,N,100,Inspirato Incorporated - Warrant,ISPOW,N
ISR,N,"",A, ,ISR,Y,N,100,"IsoRay, Inc. Common Stock (DE)",ISR,N
ISRA,Y,"",P, ,ISRA,Y,N,100,VanEck Israel ETF,ISRA,N
"",N,N,Q,Q,ISRG,Y,N,100,"Intuitive Surgical, Inc. - Common Stock",ISRG,N
"",N,N,Q,G,ISRLU,Y,N,100,Israel Acquisitions Corp - Unit,ISRLU,N
"",N,N,Q,Q,ISSC,Y,N,100,"Innovative Solutions and Support, Inc. - Common Stock",ISSC,N
"",Y,N,Q,G,ISTB,Y,N,100,iShares Core 1-5 Year USD Bond ETF,ISTB,N
"",N,N,Q,G,ISTR,Y,N,100,Investar Holding Corporation - Common Stock,ISTR,N
"",N,N,Q,S,ISUN,Y,N,100,"iSun, Inc. - Common Stock",ISUN,N
ISVL,Y,"",Z, ,ISVL,Y,N,100,iShares Trust iShares International Developed Small Cap Value Factor ETF,ISVL,N
ISWN,Y,"",P, ,ISWN,Y,N,100,Amplify BlackSwan ISWN ETF,ISWN,N
ISZE,Y,"",P, ,ISZE,Y,N,100,iShares MSCI Intl Size Factor ETF,ISZE,N
IT,N,"",N, ,IT,Y,N,100,"Gartner, Inc. Common Stock",IT,N
ITA,Y,"",Z, ,ITA,Y,N,100,iShares U.S. Aerospace & Defense ETF,ITA,N
ITAN,Y,"",P, ,ITAN,Y,N,100,Sparkline Intangible Value ETF,ITAN,N
"",N,N,Q,G,ITAQ,Y,N,100,"Industrial Tech Acquisitions II, Inc. - Class A Common Stock",ITAQ,N
"",N,N,Q,G,ITAQU,Y,N,100,"Industrial Tech Acquisitions II, Inc. - Units",ITAQU,N
"",N,N,Q,G,ITAQW,Y,N,100,"Industrial Tech Acquisitions II, Inc. - Warrants",ITAQW,N
ITB,Y,"",Z, ,ITB,Y,N,100,iShares U.S. Home Construction ETF,ITB,N
ITCB,N,"",N, ,ITCB,Y,N,100,"Itau CorpBanca American Depositary Shares (each representing 1,500 shares of Common Stock, no par value)",ITCB,N
"",N,N,Q,Q,ITCI,Y,N,100,Intra-Cellular Therapies Inc. - Common Stock,ITCI,N
ITEQ,Y,"",P, ,ITEQ,Y,N,100,BlueStar Israel Technology ETF,ITEQ,N
ITGR,N,"",N, ,ITGR,Y,N,100,Integer Holdings Corporation Common Stock,ITGR,N
"",N,N,Q,S,ITI,Y,N,100,"Iteris, Inc. - Common Stock",ITI,N
"",N,N,Q,Q,ITIC,Y,N,100,Investors Title Company - Common Stock,ITIC,N
ITM,Y,"",Z, ,ITM,Y,N,100,VanEck ETF Trust VanEck Intermediate Muni ETF,ITM,N
"",N,N,Q,G,ITOS,Y,N,100,"iTeos Therapeutics, Inc. - Common Stock",ITOS,N
ITOT,Y,"",P, ,ITOT,Y,N,100,iShares Core S&P Total U.S. Stock Market ETF,ITOT,N
ITP,N,"",A, ,ITP,Y,N,100,"IT Tech Packaging, Inc. Common Stock",ITP,N
"",N,N,Q,S,ITQ,Y,N,100,Itiquira Acquisition Corp. - Class A Ordinary Shares,ITQ,N
"",N,N,Q,S,ITQRU,Y,N,100,Itiquira Acquisition Corp. - Unit,ITQRU,N
"",N,N,Q,S,ITQRW,Y,N,100,Itiquira Acquisition Corp. - Warrant,ITQRW,N
ITRG,N,"",A, ,ITRG,Y,N,100,Integra Resources Corp. Common Shares,ITRG,N
"",N,N,Q,Q,ITRI,Y,N,100,"Itron, Inc. - Common Stock",ITRI,N
"",N,N,Q,S,ITRM,Y,N,100,Iterum Therapeutics plc - Ordinary Share,ITRM,N
"",N,N,Q,Q,ITRN,Y,N,100,Ituran Location and Control Ltd. - Ordinary Shares,ITRN,N
ITT,N,"",N, ,ITT,Y,N,100,ITT Inc. Common Stock ,ITT,N
ITUB,N,"",N, ,ITUB,Y,N,100,Itau Unibanco Banco Holding SA American Depositary Shares (Each repstg 500 Preferred shares),ITUB,N
ITW,N,"",N, ,ITW,Y,N,100,Illinois Tool Works Inc. Common Stock,ITW,N
"",Y,N,Q,G,IUS,Y,N,100,Invesco RAFI Strategic US ETF,IUS,N
IUSA,Y,"",Z, ,IUSA,Y,N,100,Northern Lights Fund Trust II Amberwave Invest USA JSG Fund,IUSA,N
"",Y,N,Q,G,IUSB,Y,N,100,iShares Core Total USD Bond Market ETF,IUSB,N
"",Y,N,Q,G,IUSG,Y,N,100,iShares Core S&P U.S. Growth ETF,IUSG,N
"",Y,N,Q,G,IUSS,Y,N,100,Invesco RAFI Strategic US Small Company ETF,IUSS,N
"",Y,N,Q,G,IUSV,Y,N,100,iShares Core S&P U.S. Value ETF,IUSV,N
"",N,N,Q,G,IVA,Y,N,100,Inventiva S.A. - American Depository Shares,IVA,N
"",N,N,Q,Q,IVAC,Y,N,100,"Intevac, Inc. - Common Stock",IVAC,N
IVAL,Y,"",Z, ,IVAL,Y,N,100,Alpha Architect International Quantitative Value ETF,IVAL,N
IVC,N,"",N, ,IVC,Y,N,100,Invacare Corporation Common Stock,IVC,N
"",N,N,Q,G,IVCA,Y,N,100,Investcorp India Acquisition Corp. - Class A Ordinary Shares,IVCA,N
"",N,N,Q,G,IVCAU,Y,N,100,Investcorp India Acquisition Corp. - Unit,IVCAU,N
"",N,N,Q,G,IVCAW,Y,N,100,Investcorp India Acquisition Corp. - Warrant,IVCAW,N
"",N,N,Q,G,IVCB,Y,N,100,Investcorp Europe Acquisition Corp I - Class A Ordinary Shares,IVCB,N
"",N,N,Q,G,IVCBU,Y,N,100,Investcorp Europe Acquisition Corp I - Unit,IVCBU,N
"",N,N,Q,G,IVCBW,Y,N,100,Investcorp Europe Acquisition Corp I - Warrant,IVCBW,N
"",N,N,Q,G,IVCP,Y,N,100,Swiftmerge Acquisition Corp. - Class A Ordinary Share,IVCP,N
"",N,N,Q,G,IVCPU,Y,N,100,Swiftmerge Acquisition Corp. - Unit,IVCPU,N
"",N,N,Q,G,IVCPW,Y,N,100,Swiftmerge Acquisition Corp. - Warrants,IVCPW,N
"",N,D,Q,S,IVDA,Y,N,100,"Iveda Solutions, Inc. - Common Stock",IVDA,N
"",N,N,Q,S,IVDAW,Y,N,100,"Iveda Solutions, Inc. - Warrant",IVDAW,N
IVDG,Y,"",Z, ,IVDG,Y,N,100,Invesco Focused Discovery Growth ETF,IVDG,N
IVE,Y,"",P, ,IVE,Y,N,100,iShares S&P 500 Value ETF,IVE,N
"",Y,N,Q,G,IVEG,Y,N,100,iShares Emergent Food and AgTech Multisector ETF,IVEG,N
IVES,Y,"",P, ,IVES,Y,N,100,Wedbush ETFMG Global Cloud Technology ETF,IVES,N
IVH,N,"",N, ,IVH,Y,N,100,Delaware Ivy High Income Opportunities Fund,IVH,N
IVLC,Y,"",Z, ,IVLC,Y,N,100,Invesco US Large Cap Core ESG ETF,IVLC,N
IVLU,Y,"",P, ,IVLU,Y,N,100,iShares MSCI Intl Value Factor ETF,IVLU,N
IVOG,Y,"",P, ,IVOG,Y,N,100,Vanguard S&P Mid-Cap 400 Growth ETF,IVOG,N
IVOL,Y,"",P, ,IVOL,Y,N,100,Quadratic Interest Rate Volatility and Inflation Hedge ETF,IVOL,N
IVOO,Y,"",P, ,IVOO,Y,N,100,Vanguard S&P Mid-Cap 400 ETF,IVOO,N
IVOV,Y,"",P, ,IVOV,Y,N,100,Vanguard S&P Mid-Cap 400 Value ETF,IVOV,N
IVR,N,"",N, ,IVR,Y,N,100,INVESCO MORTGAGE CAPITAL INC Common Stock,IVR,N
IVRpB,N,"",N, ,IVR-B,Y,N,100,Invesco Mortgage Capital Inc. Preferred Series B Cum Fxd to Fltg,IVR$B,N
IVRpC,N,"",N, ,IVR-C,Y,N,100,"INVESCO MORTGAGE CAPITAL INC 7.5% Fixed-to-Floating Series C Cumulative Redeemable Preferred Stock, Liquation Preference $25.00 per Share",IVR$C,N
IVRA,Y,"",Z, ,IVRA,Y,N,100,Invesco Real Assets ESG ETF,IVRA,N
IVSG,Y,"",Z, ,IVSG,Y,N,100,Invesco Select Growth ETF,IVSG,N
IVT,N,"",N, ,IVT,Y,N,100,InvenTrust Properties Corp. Common Stock,IVT,N
IVV,Y,"",P, ,IVV,Y,N,100,iShares Core S&P 500 ETF,IVV,N
"",N,N,Q,G,IVVD,Y,N,100,"Invivyd, Inc. - Common Stock",IVVD,N
IVW,Y,"",P, ,IVW,Y,N,100,iShares S&P 500 Growth ETF,IVW,N
IVZ,N,"",N, ,IVZ,Y,N,100,Invesco Ltd Common Stock,IVZ,N
IWB,Y,"",P, ,IWB,Y,N,100,iShares Russell 1000 ETF,IWB,N
IWC,Y,"",P, ,IWC,Y,N,100,iShares Microcap ETF,IWC,N
IWD,Y,"",P, ,IWD,Y,N,100,iShares Russell 1000 Value ETF,IWD,N
IWDL,Y,"",P, ,IWDL,Y,N,100,ETRACS 2x Leveraged US Value Factor TR ETN,IWDL,N
IWF,Y,"",P, ,IWF,Y,N,100,iShares Russell 1000 Growth ETF,IWF,N
IWFG,Y,"",P, ,IWFG,Y,N,100,IQ MacKay Municipal Insured ETF IQ Winslow Focused Large Cap Growth ETF,IWFG,N
IWFH,Y,"",P, ,IWFH,Y,N,100,iShares Virtual Work and Life Multisector ETF,IWFH,N
IWFL,Y,"",P, ,IWFL,Y,N,100,ETRACS 2x Leveraged US Growth Factor TR ETN,IWFL,N
IWIN,Y,"",P, ,IWIN,Y,N,100,Amplify ETF Trust Amplify Inflation Fighter ETF,IWIN,N
IWL,Y,"",P, ,IWL,Y,N,100,iShares Russell Top 200 ETF,IWL,N
IWLG,Y,"",P, ,IWLG,Y,N,100,IQ MacKay Municipal Insured ETF IQ Winslow Large Cap Growth ETF,IWLG,N
IWM,Y,"",P, ,IWM,Y,N,100,iShares Russell 2000 ETF,IWM,N
IWML,Y,"",P, ,IWML,Y,N,100,ETRACS 2x Leveraged US Size Factor TR ETN,IWML,N
IWN,Y,"",P, ,IWN,Y,N,100,iShares Russell 2000 Value ETF,IWN,N
IWO,Y,"",P, ,IWO,Y,N,100,iShares Russell 2000 Growth ETF,IWO,N
IWP,Y,"",P, ,IWP,Y,N,100,iShares Russell Midcap Growth ETF,IWP,N
IWR,Y,"",P, ,IWR,Y,N,100,iShares Russell Mid-Cap ETF,IWR,N
IWS,Y,"",P, ,IWS,Y,N,100,iShares Russell Mid-cap Value ETF,IWS,N
"",Y,N,Q,G,IWTR,Y,N,100,iShares MSCI Water Management Multisector ETF,IWTR,N
IWV,Y,"",P, ,IWV,Y,N,100,iShares Russell 3000 ETF,IWV,N
IWX,Y,"",P, ,IWX,Y,N,100,iShares Russell Top 200 Value ETF,IWX,N
IWY,Y,"",P, ,IWY,Y,N,100,iShares Russell Top 200 Growth ETF,IWY,N
IX,N,"",N, ,IX,Y,N,100,Orix Corp Ads Common Stock,IX,N
"",N,N,Q,G,IXAQ,Y,N,100,IX Acquisition Corp. - Class A Ordinary Share,IXAQ,N
"",N,N,Q,G,IXAQU,Y,N,100,IX Acquisition Corp. - Unit,IXAQU,N
"",N,N,Q,G,IXAQW,Y,N,100,IX Acquisition Corp. - Warrant,IXAQW,N
IXC,Y,"",P, ,IXC,Y,N,100,iShares Global Energy ETF,IXC,N
IXG,Y,"",P, ,IXG,Y,N,100,iShares Global Financial ETF,IXG,N
"",N,N,Q,G,IXHL,Y,N,100,Incannex Healthcare Limited - American Depositary Shares,IXHL,N
IXJ,Y,"",P, ,IXJ,Y,N,100,iShares Global Healthcare ETF,IXJ,N
IXN,Y,"",P, ,IXN,Y,N,100,iShares Global Tech ETF,IXN,N
IXP,Y,"",P, ,IXP,Y,N,100,iShares Global Comm Services ETF,IXP,N
IXSE,Y,"",P, ,IXSE,Y,N,100,WisdomTree India Ex-State-Owned Enterprises Fund,IXSE,N
"",Y,N,Q,G,IXUS,Y,N,100,iShares Core MSCI Total International Stock ETF,IXUS,N
IYC,Y,"",P, ,IYC,Y,N,100,iShares U.S. Consumer Discretionary ETF,IYC,N
IYE,Y,"",P, ,IYE,Y,N,100,iShares U.S. Energy ETF,IYE,N
IYF,Y,"",P, ,IYF,Y,N,100,iShares U.S. Financial ETF,IYF,N
IYG,Y,"",P, ,IYG,Y,N,100,iShares U.S. Financial Services ETF,IYG,N
IYH,Y,"",P, ,IYH,Y,N,100,iShares U.S. Healthcare ETF,IYH,N
IYJ,Y,"",Z, ,IYJ,Y,N,100,iShares U.S. Industrials ETF,IYJ,N
IYK,Y,"",P, ,IYK,Y,N,100,iShares U.S. Consumer Staples ETF,IYK,N
IYLD,Y,"",Z, ,IYLD,Y,N,100,iShares Morningstar Multi-Asset Income ETF,IYLD,N
IYM,Y,"",P, ,IYM,Y,N,100,iShares U.S. Basic Materials ETF,IYM,N
IYR,Y,"",P, ,IYR,Y,N,100,iShares U.S. Real Estate ETF,IYR,N
IYT,Y,"",Z, ,IYT,Y,N,100,iShares Trust iShares U.S. Transportation ETF,IYT,N
IYW,Y,"",P, ,IYW,Y,N,100,iShares U.S. Technology ETF,IYW,N
IYY,Y,"",P, ,IYY,Y,N,100,iShares Dow Jones U.S. ETF,IYY,N
IYZ,Y,"",Z, ,IYZ,Y,N,100,iShares U.S. Telecommunications ETF,IYZ,N
"",N,D,Q,S,IZEA,Y,N,100,"IZEA Worldwide, Inc. - Common Stock",IZEA,N
IZRL,Y,"",Z, ,IZRL,Y,N,100,ARK Israel Innovative Technology ETF,IZRL,N
J,N,"",N, ,J,Y,N,100,Jacobs Solutions Inc. Common Stock,J,N
JAAA,Y,"",P, ,JAAA,Y,N,100,Janus Henderson AAA CLO ETF,JAAA,N
"",N,N,Q,Q,JACK,Y,N,100,Jack In The Box Inc. - Common Stock,JACK,N
JAGG,Y,"",P, ,JAGG,Y,N,100,JPMorgan U.S. Aggregate Bond ETF,JAGG,N
"",N,D,Q,S,JAGX,Y,N,100,"Jaguar Health, Inc. - Common Stock",JAGX,N
"",N,N,Q,Q,JAKK,Y,N,100,"JAKKS Pacific, Inc. - Common Stock",JAKK,N
"",N,N,Q,Q,JAMF,Y,N,100,Jamf Holding Corp. - Common Stock,JAMF,N
"",N,D,Q,S,JAN,Y,N,100,JanOne Inc. - Common Stock,JAN,N
JANT,Y,"",P, ,JANT,Y,N,100,AllianzIM U.S. Large Cap Buffer10 Jan ETF,JANT,N
JANW,Y,"",P, ,JANW,Y,N,100,AllianzIM U.S. Large Cap Buffer20 Jan ETF,JANW,N
"",N,N,Q,G,JANX,Y,N,100,"Janux Therapeutics, Inc. - Common Stock",JANX,N
JANZ,Y,"",Z, ,JANZ,Y,N,100,TrueShares Structured Outcome (January) ETF,JANZ,N
"",N,N,Q,S,JAQC,Y,N,100,Jupiter Acquisition Corporation - Common stock,JAQC,N
"",N,N,Q,S,JAQCU,Y,N,100,Jupiter Acquisition Corporation - Units,JAQCU,N
"",N,N,Q,S,JAQCW,Y,N,100,Jupiter Acquisition Corporation - Warrants,JAQCW,N
JATT,N,"",N, ,JATT,Y,N,100,JATT Acquisition Corp Class A Ordinary Shares,JATT,N
JATT.U,N,"",N, ,JATT=,Y,N,100,"JATT Acquisition Corp Units, each consisting of one Class A ordinary share, and one-half of one redeemable warrant",JATT.U,N
JATT.WS,N,"",N, ,JATT+,Y,N,100,JATT Acquisition Corp Warrants,JATT.W,N
JAVA,Y,"",P, ,JAVA,Y,N,100,JPMorgan Active Value ETF,JAVA,N
"",N,N,Q,Q,JAZZ,Y,N,100,Jazz Pharmaceuticals plc - Ordinary Shares,JAZZ,N
JBBB,Y,"",Z, ,JBBB,Y,N,100,Janus Detroit Street Trust Janus Henderson B-BBB CLO ETF,JBBB,N
JBGS,N,"",N, ,JBGS,Y,N,100,JBG SMITH Properties Common Shares ,JBGS,N
"",N,N,Q,Q,JBHT,Y,N,100,"J.B. Hunt Transport Services, Inc. - Common Stock",JBHT,N
JBI,N,"",N, ,JBI,Y,N,100,"Janus International Group, Inc. Common Stock",JBI,N
JBK,N,"",N, ,JBK,Y,N,100,Lehman ABS 3.50 3.50% Adjustable Corp Backed Tr Certs GS Cap I,JBK,N
JBL,N,"",N, ,JBL,Y,N,100,Jabil Inc. Common Stock,JBL,N
"",N,N,Q,Q,JBLU,Y,N,100,JetBlue Airways Corporation - Common Stock,JBLU,N
"",N,N,Q,Q,JBSS,Y,N,100,"John B. Sanfilippo & Son, Inc. - Common Stock",JBSS,N
JBT,N,"",N, ,JBT,Y,N,100,John Bean Technologies Corporation Common Stock,JBT,N
JCE,N,"",N, ,JCE,Y,N,100,Nuveen Core Equity Alpha Fund Nuveen Core Equity Alpha Fund Common Shares of Beneficial Interest,JCE,N
JCI,N,"",N, ,JCI,Y,N,100,Johnson Controls International plc Ordinary Share,JCI,N
"",N,N,Q,S,JCIC,Y,N,100,Jack Creek Investment Corp. - Class A Ordinary Shares,JCIC,N
"",N,N,Q,S,JCICU,Y,N,100,Jack Creek Investment Corp. - Units,JCICU,N
"",N,N,Q,S,JCICW,Y,N,100,Jack Creek Investment Corp. - Warrants,JCICW,N
JCPB,Y,"",Z, ,JCPB,Y,N,100,JPMorgan Core Plus Bond ETF,JCPB,N
JCPI,Y,"",Z, ,JCPI,Y,N,100,J P MORGAN EXCHANGE-TRADED FD TR JPMorgan Inflation Managed Bond ETF,JCPI,N
"",N,D,Q,S,JCSE,Y,N,100,JE Cleantech Holdings Limited - Ordinary Shares,JCSE,N
"",N,N,Q,S,JCTCF,Y,N,100,Jewett-Cameron Trading Company - Common Shares,JCTCF,N
JCTR,Y,"",P, ,JCTR,Y,N,100,JPMorgan Carbon Transition U.S. Equity ETF,JCTR,N
"",N,N,Q,Q,JD,Y,N,100,"JD.com, Inc. - American Depositary Shares",JD,N
JDST,Y,"",P, ,JDST,Y,N,100,Direxion Daily Junior Gold Miners Index Bear 2X Shares,JDST,N
JEF,N,"",N, ,JEF,Y,N,100,Jefferies Financial Group Inc. Common Stock,JEF,N
JEFw,N,"",N, ,JEF#,Y,N,100,Jefferies Financial Group Inc. Common Stock When-Issued,JEF.V,N
JELD,N,"",N, ,JELD,Y,N,100,"JELD-WEN Holding, Inc. Common Stock",JELD,N
JEMA,Y,"",Z, ,JEMA,Y,N,100,JPMorgan ActiveBuilders Emerging Markets Equity ETF,JEMA,N
JEPI,Y,"",P, ,JEPI,Y,N,100,JPMorgan Equity Premium Income ETF,JEPI,N
"",Y,N,Q,G,JEPQ,Y,N,100,JPMorgan Nasdaq Equity Premium Income ETF,JEPQ,N
JEQ,N,"",N, ,JEQ,Y,N,100,"abrdn Japan Equity Fund, Inc. Common Stock",JEQ,N
JETS,Y,"",P, ,JETS,Y,N,100,U.S. Global Jets ETF,JETS,N
"",N,N,Q,S,JEWL,Y,N,100,Adamas One Corp. - Common Stock,JEWL,N
"",N,N,Q,S,JFBR,Y,N,100,Jeffs' Brands Ltd - Ordinary Shares,JFBR,N
"",N,N,Q,S,JFBRW,Y,N,100,Jeffs' Brands Ltd - Warrant,JFBRW,N
"",N,N,Q,G,JFIN,Y,N,100,Jiayin Group Inc. - American Depositary Shares,JFIN,N
JFR,N,"",N, ,JFR,Y,N,100,Nuveen Floating Rate Income Fund Common Stock,JFR,N
"",N,D,Q,G,JFU,Y,N,100,9F Inc. - American Depositary Shares,JFU,N
JFWD,Y,"",P, ,JFWD,Y,N,100,Jacob Funds Inc. Jacob Forward ETF,JFWD,N
"",N,D,Q,G,JG,Y,N,100,Aurora Mobile Limited - American Depositary Shares,JG,N
"",N,N,Q,G,JGGC,Y,N,100,Jaguar Global Growth Corporation I - Class A Ordinary Shares,JGGC,N
"",N,N,Q,G,JGGCR,Y,N,100,Jaguar Global Growth Corporation I - Right,JGGCR,N
"",N,N,Q,G,JGGCU,Y,N,100,Jaguar Global Growth Corporation I - Unit,JGGCU,N
"",N,N,Q,G,JGGCW,Y,N,100,Jaguar Global Growth Corporation I - Warrant,JGGCW,N
JGH,N,"",N, ,JGH,Y,N,100,Nuveen Global High Income Fund Common Shares of Beneficial Interest,JGH,N
JGRO,Y,"",P, ,JGRO,Y,N,100,J.P. Morgan Exchange-Traded Fund Trust JPMorgan Active Growth ETF,JGRO,N
JHAA,N,"",N, ,JHAA,Y,N,100,Nuveen Corporate Income 2023 Target Term Fund,JHAA,N
JHCB,Y,"",P, ,JHCB,Y,N,100,John Hancock Corporate Bond ETF,JHCB,N
JHDV,Y,"",P, ,JHDV,Y,N,100,John Hancock Exchange-Traded Fund Trust John Hancock U.S. High Dividend ETF,JHDV,N
JHEM,Y,"",P, ,JHEM,Y,N,100,John Hancock Multifactor Emerging Markets ETF,JHEM,N
JHG,N,"",N, ,JHG,Y,N,100,Janus Henderson Group plc Ordinary Shares,JHG,N
JHI,N,"",N, ,JHI,Y,N,100,John Hancock Investors Trust Common Stock,JHI,N
JHID,Y,"",P, ,JHID,Y,N,100,John Hancock Exchange-Traded Fund Trust John Hancock International High Dividend ETF,JHID,N
JHMB,Y,"",P, ,JHMB,Y,N,100,John Hancock Mortgage-Backed Securities ETF,JHMB,N
JHMD,Y,"",P, ,JHMD,Y,N,100,John Hancock Exchange-Traded Fund Trust John Hancock Multifactor Developed International ETF,JHMD,N
JHML,Y,"",P, ,JHML,Y,N,100,John Hancock Multifactor Large Cap ETF,JHML,N
JHMM,Y,"",P, ,JHMM,Y,N,100,John Hancock Multifactor Mid Cap ETF,JHMM,N
JHPI,Y,"",P, ,JHPI,Y,N,100,John Hancock Exchange-Traded Fund Trust John Hancock Preferred Income ETF,JHPI,N
JHS,N,"",N, ,JHS,Y,N,100,John Hancock Income Securities Trust Common Stock,JHS,N
JHSC,Y,"",P, ,JHSC,Y,N,100,John Hancock Multifactor Small Cap ETF,JHSC,N
JHX,N,"",N, ,JHX,Y,N,100,James Hardie Industries plc American Depositary Shares (Ireland),JHX,N
JIB,Y,"",P, ,JIB,Y,N,100,Janus Henderson Sustainable & Impact Core Bond ETF,JIB,N
JIDA,Y,"",P, ,JIDA,Y,N,100,JPMorgan ActiveBuilders International Equity ETF,JIDA,N
JIG,Y,"",P, ,JIG,Y,N,100,JPMorgan International Growth ETF,JIG,N
JIGB,Y,"",P, ,JIGB,Y,N,100,JPMorgan Corporate Bond Research Enhanced ETF,JIGB,N
JILL,N,"",N, ,JILL,Y,N,100,"J. Jill, Inc. Common Stock",JILL,N
JIRE,Y,"",P, ,JIRE,Y,N,100,J.P. Morgan Exchange-Traded Fund Trust JPMorgan International Research Enhanced Equity ETF,JIRE,N
JJA,N,"",P, ,JJA,Y,N,100,iPathA Series B Bloomberg Agriculture Subindex Total Return ETN,JJA,N
JJC,N,"",P, ,JJC,Y,N,100,iPathA Series B Bloomberg Copper Subindex Total Return ETN,JJC,N
JJE,N,"",P, ,JJE,Y,N,100,iPathA Series B Bloomberg Energy Subindex Total Return ETN,JJE,N
JJG,N,"",P, ,JJG,Y,N,100,iPathA Series B Bloomberg Grains Subindex Total Return ETN,JJG,N
JJM,N,"",P, ,JJM,Y,N,100,iPathA Series B Bloomberg Industrial Metals Subindex Total Return ETN,JJM,N
JJN,N,"",P, ,JJN,Y,N,100,iPathA Series B Bloomberg Nickel Subindex Total Return ETN,JJN,N
JJP,N,"",P, ,JJP,Y,N,100,iPathA Series B Bloomberg Precious Metals Subindex Total Return ETN,JJP,N
JJS,N,"",P, ,JJS,Y,N,100,iPathA Series B Bloomberg Softs Subindex Total Return ETN,JJS,N
"",N,N,Q,Q,JJSF,Y,N,100,J & J Snack Foods Corp. - Common Stock,JJSF,N
JJT,N,"",P, ,JJT,Y,N,100,iPathA Series B Bloomberg Tin Subindex Total Return ETN,JJT,N
JJU,N,"",P, ,JJU,Y,N,100,iPathA Series B Bloomberg Aluminum Subindex Total Return ETN,JJU,N
"",N,N,Q,Q,JKHY,Y,N,100,"Jack Henry & Associates, Inc. - Common Stock",JKHY,N
JKS,N,"",N, ,JKS,Y,N,100,JinkoSolar Holding Company Limited American Depositary Shares (each representing 4 Common Shares),JKS,N
JLL,N,"",N, ,JLL,Y,N,100,Jones Lang LaSalle Incorporated Common Stock,JLL,N
JLS,N,"",N, ,JLS,Y,N,100,Nuveen Mortgage and Income Fund,JLS,N
"",N,N,Q,G,JMAC,Y,N,100,Maxpro Capital Acquisition Corp. - Class A Common Stock,JMAC,N
"",N,N,Q,G,JMACU,Y,N,100,Maxpro Capital Acquisition Corp. - Units,JMACU,N
"",N,N,Q,G,JMACW,Y,N,100,Maxpro Capital Acquisition Corp. - Warrants,JMACW,N
JMBS,Y,"",P, ,JMBS,Y,N,100,Janus Henderson Mortgage-Backed Securities ETF,JMBS,N
JMEE,Y,"",P, ,JMEE,Y,N,100,J.P. Morgan Exchange-Traded Fund Trust JPMorgan Market Expansion Enhanced Equity ETF,JMEE,N
JMIA,N,"",N, ,JMIA,Y,N,100,"Jumia Technologies AG American Depositary Shares, each representing two Ordinary Shares",JMIA,N
JMM,N,"",N, ,JMM,Y,N,100,Nuveen Multi-Market Income Fund (MA),JMM,N
JMOM,Y,"",P, ,JMOM,Y,N,100,JPMorgan U.S. Momentum Factor ETF,JMOM,N
"",N,N,Q,S,JMSB,Y,N,100,"John Marshall Bancorp, Inc. - Common Stock",JMSB,N
JMST,Y,"",Z, ,JMST,Y,N,100,JPMorgan Ultra-Short Municipal Income ETF,JMST,N
JMUB,Y,"",Z, ,JMUB,Y,N,100,JPMorgan Municipal ETF,JMUB,N
"",N,N,Q,Q,JNCE,Y,N,100,"Jounce Therapeutics, Inc. - Common Stock",JNCE,N
JNJ,N,"",N, ,JNJ,Y,N,100,Johnson & Johnson Common Stock,JNJ,N
JNK,Y,"",P, ,JNK,Y,N,100,SPDR Bloomberg High Yield Bond ETF,JNK,N
JNPR,N,"",N, ,JNPR,Y,N,100,"Juniper Networks, Inc. Common Stock",JNPR,N
JNUG,Y,"",P, ,JNUG,Y,N,100,Direxion Daily Junior Gold Miners Index Bull 2X Shares,JNUG,N
JO,N,"",P, ,JO,Y,N,100,iPathA Series B Bloomberg Coffee Subindex Total Return ETN,JO,N
"",N,N,Q,G,JOAN,Y,N,100,"JOANN, Inc. - common stock",JOAN,N
JOB,N,"",A, ,JOB,Y,N,100,GEE Group Inc. Common Stock,JOB,N
JOBY,N,"",N, ,JOBY,Y,N,100,"Joby Aviation, Inc. Common Stock",JOBY,N
JOBY.WS,N,"",N, ,JOBY+,Y,N,100,"Joby Aviation, Inc. Warrants",JOBY.W,N
JOE,N,"",N, ,JOE,Y,N,100,St. Joe Company (The) Common Stock,JOE,N
"",Y,N,Q,G,JOET,Y,N,100,Virtus Terranova U.S. Quality Momentum ETF,JOET,N
JOF,N,"",N, ,JOF,Y,N,100,Japan Smaller Capitalization Fund Inc Common Stock,JOF,N
JOJO,Y,"",P, ,JOJO,Y,N,100,ATAC Credit Rotation ETF,JOJO,N
"",N,N,Q,Q,JOUT,Y,N,100,Johnson Outdoors Inc. - Class A Common Stock,JOUT,N
JPC,N,"",N, ,JPC,Y,N,100,Nuveen Preferred & Income Opportunities Fund,JPC,N
JPEM,Y,"",P, ,JPEM,Y,N,100,JPMorgan Diversified Return Emerging Markets Equity ETF,JPEM,N
JPHY,Y,"",Z, ,JPHY,Y,N,100,JPMorgan Research Enhanced High Yield ETF,JPHY,N
JPI,N,"",N, ,JPI,Y,N,100,Nuveen Preferred and Income Term Fund Common Shares of Beneficial Interest,JPI,N
JPIB,Y,"",Z, ,JPIB,Y,N,100,J.P. Morgan Exchange-Traded Fund Trust JPMorgan International Bond Opportunities ETF,JPIB,N
JPIE,Y,"",P, ,JPIE,Y,N,100,JPMorgan Income ETF,JPIE,N
JPIN,Y,"",P, ,JPIN,Y,N,100,JPMorgan Diversified Return International Equity ETF,JPIN,N
JPM,N,"",N, ,JPM,Y,N,100,JP Morgan Chase & Co. Common Stock,JPM,N
JPMpC,N,"",N, ,JPM-C,Y,N,100,"J P Morgan Chase & Co Depositary Shares, each representing a 1/400th interest in a share of 6.00% Non-Cumulative  Preferred Stock, Series EE",JPM$C,N
JPMpD,N,"",N, ,JPM-D,Y,N,100,"J P Morgan Chase & Co Depositary Shares, each representing a 1/400th  interest in a share of 5.75% Non-Cumulative  Preferred Stock, Series DD",JPM$D,N
JPMpJ,N,"",N, ,JPM-J,Y,N,100,"J P Morgan Chase & Co Depositary Shares, each representing a 1/400th interest in a share of JPMorgan Chase & Co. 4.75% Non-Cumulative Preferred Stock, Series GG",JPM$J,N
JPMpK,N,"",N, ,JPM-K,Y,N,100,"J P Morgan Chase & Co Depositary Shares, each representing a 1/400th interest in a share of 4.55% Non-Cumulative Preferred Stock, Series JJ",JPM$K,N
JPMpL,N,"",N, ,JPM-L,Y,N,100,"J P Morgan Chase & Co Depositary Shares, each representing a 1/400th interest in a share of 4.625% Non-Cumulative Preferred Stock, Series LL",JPM$L,N
JPMpM,N,"",N, ,JPM-M,Y,N,100,"J P Morgan Chase & Co Depositary Shares, each representing a 1/400th interest in a share of 4.20% Non-Cumulative Preferred Stock, Series MM",JPM$M,N
JPMB,Y,"",P, ,JPMB,Y,N,100,JPMorgan USD Emerging Markets Sovereign Bond ETF,JPMB,N
JPME,Y,"",P, ,JPME,Y,N,100,JPMorgan Diversified Return U.S. Mid Cap Equity ETF,JPME,N
JPRE,Y,"",P, ,JPRE,Y,N,100,J.P. Morgan Exchange-Traded Fund Trust JPMorgan Realty Income ETF,JPRE,N
JPS,N,"",N, ,JPS,Y,N,100,Nuveen Preferred & Income Securities Fund,JPS,N
JPSE,Y,"",P, ,JPSE,Y,N,100,JPMorgan Diversified Return U.S. Small Cap Equity ETF,JPSE,N
JPST,Y,"",P, ,JPST,Y,N,100,JPMorgan Ultra-Short Income ETF,JPST,N
JPT,N,"",N, ,JPT,Y,N,100,Nuveen Preferred and Income Fund Common Shares of Beneficial Interest,JPT,N
JPUS,Y,"",P, ,JPUS,Y,N,100,JPMorgan Diversified Return U.S. Equity ETF,JPUS,N
JPXN,Y,"",P, ,JPXN,Y,N,100,iShares JPX-Nikkei 400 ETF,JPXN,N
JQC,N,"",N, ,JQC,Y,N,100,Nuveen Credit Strategies Income Fund Shares of Beneficial Interest,JQC,N
JQUA,Y,"",P, ,JQUA,Y,N,100,JPMorgan U.S. Quality Factor ETF,JQUA,N
JRE,Y,"",P, ,JRE,Y,N,100,Janus Henderson U.S. Real Estate ETF,JRE,N
JRI,N,"",N, ,JRI,Y,N,100,Nuveen Real Asset Income and Growth Fund Common Shares of Beneficial Interest,JRI,N
JRNY,Y,"",P, ,JRNY,Y,N,100,ALPS Global Travel Beneficiaries ETF,JRNY,N
JRO,N,"",N, ,JRO,Y,N,100,Nuveen Floating Rate Income Opportuntiy Fund Shares of Beneficial Interest,JRO,N
JRS,N,"",N, ,JRS,Y,N,100,Nuveen Real Estate Income Fund Common Shares of Beneficial Interest,JRS,N
"",N,N,Q,S,JRSH,Y,N,100,"Jerash Holdings (US), Inc. - Common Stock",JRSH,N
"",N,N,Q,Q,JRVR,Y,N,100,"James River Group Holdings, Ltd. - Common Shares",JRVR,N
JSCP,Y,"",P, ,JSCP,Y,N,100,JPMorgan Short Duration Core Plus ETF,JSCP,N
JSD,N,"",N, ,JSD,Y,N,100,Nuveen Short Duration Credit Opportunities Fund Common Shares of Beneficial Interest,JSD,N
"",N,N,Q,Q,JSM,Y,N,100,"Navient Corporation - 6% Senior Notes due December 15, 2043",JSM,N
"",Y,N,Q,G,JSMD,Y,N,100,Janus Henderson Small/Mid Cap Growth Alpha ETF,JSMD,N
"",Y,N,Q,G,JSML,Y,N,100,Janus Henderson Small Cap Growth Alpha ETF,JSML,N
"",N,D,Q,S,JSPR,Y,N,100,"Jasper Therapeutics, Inc. - Class A Common Stock",JSPR,N
"",N,N,Q,S,JSPRW,Y,N,100,"Jasper Therapeutics, Inc. - Warrant",JSPRW,N
JSTC,Y,"",P, ,JSTC,Y,N,100,Adasina Social Justice All Cap Global ETF,JSTC,N
JT,N,"",N, ,JT,Y,N,100,Jianpu Technology Inc. American depositary shares,JT,N
JUCY,Y,"",Z, ,JUCY,Y,N,100,ETF Series Solutions Aptus Enhanced Yield ETF,JUCY,N
"",N,N,Q,S,JUGG,Y,N,100,Jaws Juggernaut Acquisition Corporation - Class A Ordinary Share,JUGG,N
"",N,N,Q,S,JUGGU,Y,N,100,Jaws Juggernaut Acquisition Corporation - Unit,JUGGU,N
"",N,N,Q,S,JUGGW,Y,N,100,Jaws Juggernaut Acquisition Corporation - Warrant,JUGGW,N
JULT,Y,"",P, ,JULT,Y,N,100,AllianzIM U.S. Large Cap Buffer10 Jul ETF,JULT,N
JULW,Y,"",P, ,JULW,Y,N,100,AllianzIM U.S. Large Cap Buffer20 Jul ETF,JULW,N
JULZ,Y,"",Z, ,JULZ,Y,N,100,TrueShares Structured Outcome (July) ETF,JULZ,N
JUN,N,"",N, ,JUN,Y,N,100,Juniper II Corp. Class A Common Stock,JUN,N
JUN.U,N,"",N, ,JUN=,Y,N,100,"Juniper II Corp. Units, each consisting of one share of Class A common stock, and one-half of one redeemable warrant",JUN.U,N
