CQS Symbol,ETF,Financial Status,Listing Exchange,Market Category,NASDAQ Symbol,Nasdaq Traded,NextShares,Round Lot Size,Security Name,Symbol,Test Issue
A,N,"",N, ,A,Y,N,100,"Agilent Technologies, Inc. Common Stock",A,N
AA,N,"",N, ,AA,Y,N,100,Alcoa Corporation Common Stock ,AA,N
AAA,Y,"",P, ,AAA,Y,N,100,Investment Managers Series Trust II AXS First Priority CLO Bond ETF,AAA,N
AAAU,Y,"",Z, ,AAAU,Y,N,100,Goldman Sachs Physical Gold ETF Shares,AAAU,N
AAC,N,"",N, ,AAC,Y,N,100,Ares Acquisition Corporation Class A Ordinary Shares,AAC,N
AAC.U,N,"",N, ,AAC=,Y,N,100,"Ares Acquisition Corporation Units, each consisting of one Class A ordinary share, and one-fifth of one redeemable warrant",AAC.U,N
AAC.WS,N,"",N, ,AAC+,Y,N,100,"Ares Acquisition Corporation Redeemable Warrants, each whole warrant exercisable for one Class A ordinary share at an exercise price of $11.50",AAC.W,N
"",N,N,Q,G,AACG,Y,N,100,"ATA Creativity Global - American Depositary Shares, each representing two common shares",AACG,N
"",N,N,Q,G,AACI,Y,N,100,Armada Acquisition Corp. I - Common Stock,AACI,N
"",N,N,Q,G,AACIU,Y,N,100,Armada Acquisition Corp. I - Unit,AACIU,N
"",N,N,Q,G,AACIW,Y,N,100,Armada Acquisition Corp. I - Warrant,AACIW,N
"",N,N,Q,S,AADI,Y,N,100,"Aadi Bioscience, Inc. - Common Stock",AADI,N
"",Y,N,Q,G,AADR,Y,N,100,AdvisorShares Dorsey Wright ADR ETF,AADR,N
AAIC,N,"",N, ,AAIC,Y,N,100,Arlington Asset Investment Corp Class A (new),AAIC,N
AAICpB,N,"",N, ,AAIC-B,Y,N,100,Arlington Asset Investment Corp 7.00% ,AAIC$B,N
AAICpC,N,"",N, ,AAIC-C,Y,N,100,Arlington Asset Investment Corp 8.250% Seies C Fixed-to-Floating Rate Cumulative Redeemable Preferred Stock   ,AAIC$C,N
AAIN,N,"",N, ,AAIN,Y,N,100,Arlington Asset Investment Corp 6.000% Senior Notes Due 2026,AAIN,N
"",N,N,Q,Q,AAL,Y,N,100,"American Airlines Group, Inc. - Common Stock",AAL,N
AAMpA,N,"",N, ,AAM-A,Y,N,100,"Apollo Asset Management, Inc. 6.375% Series A Preferred Stock",AAM$A,N
AAMpB,N,"",N, ,AAM-B,Y,N,100,"Apollo Asset Management, Inc. 6.375% Series B Preferred Stock",AAM$B,N
AAMC,N,"",A, ,AAMC,Y,N,100,Altisource Asset Management Corp Com,AAMC,N
"",N,N,Q,G,AAME,Y,N,100,Atlantic American Corporation - Common Stock,AAME,N
AAN,N,"",N, ,AAN,Y,N,100,"Aarons Holdings Company, Inc. Common Stock ",AAN,N
"",N,N,Q,G,AAOI,Y,N,100,"Applied Optoelectronics, Inc. - Common Stock",AAOI,N
"",N,N,Q,Q,AAON,Y,N,100,"AAON, Inc. - Common Stock",AAON,N
AAP,N,"",N, ,AAP,Y,N,100,Advance Auto Parts Inc.,AAP,N
"",Y,N,Q,G,AAPB,Y,N,100,GraniteShares 1.75x Long AAPL Daily ETF,AAPB,N
"",Y,N,Q,G,AAPD,Y,N,100,Direxion Daily AAPL Bear 1X Shares,AAPD,N
"",N,N,Q,Q,AAPL,Y,N,100,Apple Inc. - Common Stock,AAPL,N
"",Y,N,Q,G,AAPU,Y,N,100,Direxion Daily AAPL Bull 1.5X Shares,AAPU,N
AAT,N,"",N, ,AAT,Y,N,100,"American Assets Trust, Inc. Common Stock",AAT,N
AAU,N,"",A, ,AAU,Y,N,100,"Almaden Minerals, Ltd. Common Shares",AAU,N
"",N,N,Q,Q,AAWW,Y,N,100,Atlas Air Worldwide Holdings - Common Stock,AAWW,N
"",Y,N,Q,G,AAXJ,Y,N,100,iShares MSCI All Country Asia ex Japan Index Fund,AAXJ,N
AB,N,"",N, ,AB,Y,N,100,AllianceBernstein Holding L.P.  Units,AB,N
ABB,N,"",N, ,ABB,Y,N,100,ABB Ltd Common Stock,ABB,N
ABBV,N,"",N, ,ABBV,Y,N,100,AbbVie Inc. Common Stock,ABBV,N
ABC,N,"",N, ,ABC,Y,N,100,AmerisourceBergen Corporation Common Stock,ABC,N
"",N,N,Q,Q,ABCB,Y,N,100,Ameris Bancorp - Common Stock,ABCB,N
"",N,N,Q,Q,ABCL,Y,N,100,AbCellera Biologics Inc. - Common Shares,ABCL,N
"",N,N,Q,Q,ABCM,Y,N,100,Abcam plc - American Depositary Shares,ABCM,N
"",N,N,Q,S,ABEO,Y,N,100,Abeona Therapeutics Inc. - Common Stock,ABEO,N
ABEQ,Y,"",P, ,ABEQ,Y,N,100,Absolute Select Value ETF,ABEQ,N
ABEV,N,"",N, ,ABEV,Y,N,100,Ambev S.A. American Depositary Shares (Each representing 1 Common Share),ABEV,N
ABG,N,"",N, ,ABG,Y,N,100,Asbury Automotive Group Inc Common Stock,ABG,N
"",N,N,Q,S,ABGI,Y,N,100,ABG Acquisition Corp. I - Class A Ordinary Shares,ABGI,N
"",N,N,Q,S,ABIO,Y,N,100,"ARCA biopharma, Inc. - Common Stock",ABIO,N
ABM,N,"",N, ,ABM,Y,N,100,ABM Industries Incorporated Common Stock,ABM,N
"",N,N,Q,Q,ABNB,Y,N,100,"Airbnb, Inc. - Class A Common Stock",ABNB,N
"",N,N,Q,Q,ABOS,Y,N,100,"Acumen Pharmaceuticals, Inc. - Common Stock",ABOS,N
ABR,N,"",N, ,ABR,Y,N,100,Arbor Realty Trust Common Stock,ABR,N
ABRpD,N,"",N, ,ABR-D,Y,N,100,"Arbor Realty Trust 6.375% Series D Cumulative Redeemable Preferred Stock, Liquidation Preference $25.00 per Share",ABR$D,N
ABRpE,N,"",N, ,ABR-E,Y,N,100,Arbor Realty Trust 6.25% Series E Cumulative Redeemable Preferred Stock,ABR$E,N
ABRpF,N,"",N, ,ABR-F,Y,N,100,"Arbor Realty Trust 6.25% Series F Fixed-to-Floating Rate Cumulative Redeemable Preferred Stock, Liquidation Preference $25.00 per share",ABR$F,N
"",N,N,Q,Q,ABSI,Y,N,100,Absci Corporation - Common Stock,ABSI,N
"",N,N,Q,Q,ABST,Y,N,100,Absolute Software Corporation - Common Stock,ABST,N
ABT,N,"",N, ,ABT,Y,N,100,Abbott Laboratories Common Stock,ABT,N
"",N,N,Q,Q,ABUS,Y,N,100,Arbutus Biopharma Corporation - Common Stock,ABUS,N
"",N,D,Q,S,ABVC,Y,N,100,"ABVC BioPharma, Inc. - Common Stock",ABVC,N
AC,N,"",N, ,AC,Y,N,100,"Associated Capital Group, Inc. Common Stock",AC,N
ACA,N,"",N, ,ACA,Y,N,100,"Arcosa, Inc. Common Stock ",ACA,N
"",N,N,Q,G,ACAB,Y,N,100,Atlantic Coastal Acquisition Corp. II - Class A Common Stock,ACAB,N
"",N,N,Q,G,ACABU,Y,N,100,Atlantic Coastal Acquisition Corp. II - Unit,ACABU,N
"",N,N,Q,G,ACABW,Y,N,100,Atlantic Coastal Acquisition Corp. II - Warrant,ACABW,N
"",N,N,Q,G,ACAC,Y,N,100,Acri Capital Acquisition Corporation - Class A Common Stock,ACAC,N
"",N,N,Q,G,ACACU,Y,N,100,Acri Capital Acquisition Corporation - Unit,ACACU,N
"",N,N,Q,G,ACACW,Y,N,100,Acri Capital Acquisition Corporation - Warrant,ACACW,N
"",N,N,Q,Q,ACAD,Y,N,100,ACADIA Pharmaceuticals Inc. - Common Stock,ACAD,N
"",N,N,Q,S,ACAH,Y,N,100,Atlantic Coastal Acquisition Corp. - Class A Common Stock,ACAH,N
"",N,N,Q,S,ACAHU,Y,N,100,Atlantic Coastal Acquisition Corp. - Unit,ACAHU,N
"",N,N,Q,S,ACAHW,Y,N,100,Atlantic Coastal Acquisition Corp. - Warrant,ACAHW,N
ACAQ,N,"",N, ,ACAQ,Y,N,100,Athena Consumer Acquisition Corp. Class A Common Stock,ACAQ,N
ACAQ.U,N,"",N, ,ACAQ=,Y,N,100,"Athena Consumer Acquisition Corp. Units, each consisting of one share of Class A common stock and one-half of one Redeemable Warrant",ACAQ.U,N
ACAQ.WS,N,"",N, ,ACAQ+,Y,N,100,Athena Consumer Acquisition Corp. Redeemable warrants,ACAQ.W,N
"",N,N,Q,G,ACAX,Y,N,100,Alset Capital Acquisition Corp. - Class A Common Stock,ACAX,N
"",N,N,Q,G,ACAXR,Y,N,100,Alset Capital Acquisition Corp. - Right,ACAXR,N
"",N,N,Q,G,ACAXU,Y,N,100,Alset Capital Acquisition Corp. - Unit,ACAXU,N
"",N,N,Q,G,ACAXW,Y,N,100,Alset Capital Acquisition Corp. - Warrant,ACAXW,N
"",N,N,Q,Q,ACB,Y,N,100,Aurora Cannabis Inc. - Common Shares,ACB,N
"",N,N,Q,S,ACBA,Y,N,100,Ace Global Business Acquisition Limited - Ordinary Shares,ACBA,N
"",N,N,Q,S,ACBAU,Y,N,100,Ace Global Business Acquisition Limited - Unit,ACBAU,N
"",N,N,Q,S,ACBAW,Y,N,100,Ace Global Business Acquisition Limited - Warrant,ACBAW,N
"",N,N,Q,Q,ACCD,Y,N,100,"Accolade, Inc. - common stock",ACCD,N
ACCO,N,"",N, ,ACCO,Y,N,100,Acco Brands Corporation Common Stock,ACCO,N
"",N,N,Q,Q,ACDC,Y,N,100,ProFrac Holding Corp. - Class A Common Stock,ACDC,N
"",N,N,Q,Q,ACDCW,Y,N,100,ProFrac Holding Corp. - Warrant,ACDCW,N
ACDI,N,"",N, ,ACDI,Y,N,100,Ascendant Digital Acquisition Corp. III Class A Ordinary Shares,ACDI,N
ACDI.U,N,"",N, ,ACDI=,Y,N,100,"Ascendant Digital Acquisition Corp. III Units, each consisting of one Class A ordinary share and one-half of one redeemable warrant",ACDI.U,N
ACEL,N,"",N, ,ACEL,Y,N,100,"Accel Entertainment, Inc. ",ACEL,N
"",N,N,Q,S,ACER,Y,N,100,Acer Therapeutics Inc. - Common Stock,ACER,N
ACES,Y,"",P, ,ACES,Y,N,100,ALPS Clean Energy ETF,ACES,N
"",N,N,Q,G,ACET,Y,N,100,"Adicet Bio, Inc. - Common Stock",ACET,N
"",N,N,Q,Q,ACGL,Y,N,100,Arch Capital Group Ltd. - Common Stock,ACGL,N
"",N,N,Q,Q,ACGLN,Y,N,100,"Arch Capital Group Ltd. - Depositary Shares, each Representing a 1/1,000th Interest in a 4.550% Non-Cumulative Preferred Share, Series G",ACGLN,N
"",N,N,Q,Q,ACGLO,Y,N,100,"Arch Capital Group Ltd. - Depositary Shares Each Representing 1/1,000th Interest in a Share of5.45% Non-Cumulative Preferred Shares, Series F",ACGLO,N
"",N,N,Q,Q,ACHC,Y,N,100,"Acadia Healthcare Company, Inc. - Common Stock",ACHC,N
"",N,N,Q,Q,ACHL,Y,N,100,Achilles Therapeutics plc - American Depositary Shares,ACHL,N
ACHR,N,"",N, ,ACHR,Y,N,100,Archer Aviation Inc. Class A Common Stock,ACHR,N
ACHR.WS,N,"",N, ,ACHR+,Y,N,100,"Archer Aviation Inc. Redeemable Warrants, each whole warrant exercisable for one Class A common stock at an exercise price of $11.50",ACHR.W,N
"",N,D,Q,S,ACHV,Y,N,100,"Achieve Life Sciences, Inc.  - Common Shares",ACHV,N
ACI,N,"",N, ,ACI,Y,N,100,"Albertsons Companies, Inc. Class A Common Stock",ACI,N
ACIO,Y,"",Z, ,ACIO,Y,N,100,ETF Series Solutions Aptus Collared Income Opportunity ETF,ACIO,N
"",N,N,Q,G,ACIU,Y,N,100,AC Immune SA - Common Stock,ACIU,N
"",N,N,Q,Q,ACIW,Y,N,100,"ACI Worldwide, Inc. - Common Stock",ACIW,N
"",N,N,Q,Q,ACLS,Y,N,100,"Axcelis Technologies, Inc. - Common Stock",ACLS,N
"",N,N,Q,Q,ACLX,Y,N,100,"Arcellx, Inc. - Common Stock",ACLX,N
ACM,N,"",N, ,ACM,Y,N,100,AECOM Common Stock,ACM,N
"",N,N,Q,G,ACMR,Y,N,100,"ACM Research, Inc. - Class A Common Stock",ACMR,N
ACN,N,"",N, ,ACN,Y,N,100,Accenture plc Class A Ordinary Shares (Ireland),ACN,N
"",N,N,Q,S,ACNB,Y,N,100,ACNB Corporation - Common Stock,ACNB,N
"",N,N,Q,G,ACNT,Y,N,100,Ascent Industries Co. - Common Stock,ACNT,N
"",N,D,Q,S,ACON,Y,N,100,"Aclarion, Inc. - Common Stock",ACON,N
"",N,N,Q,S,ACONW,Y,N,100,"Aclarion, Inc. - Warrant",ACONW,N
"",N,D,Q,Q,ACOR,Y,N,100,"Acorda Therapeutics, Inc. - Common Stock",ACOR,N
ACP,N,"",N, ,ACP,Y,N,100,abrdn Income Credit Strategies Fund Common Shares,ACP,N
ACPpA,N,"",N, ,ACP-A,Y,N,100,abrdn Income Credit Strategies Fund 5.250% Series A Perpetual Preferred Stock,ACP$A,N
"",N,N,Q,S,ACQR,Y,N,100,Independence Holdings Corp. - Class A Ordinary Share,ACQR,N
"",N,N,Q,S,ACQRU,Y,N,100,Independence Holdings Corp. - Units,ACQRU,N
"",N,N,Q,S,ACQRW,Y,N,100,Independence Holdings Corp. - Warrant,ACQRW,N
ACR,N,"",N, ,ACR,Y,N,100,ACRES Commercial Realty Corp. Common Stock,ACR,N
ACRpC,N,"",N, ,ACR-C,Y,N,100,ACRES Commercial Realty Corp. 8.625% Fixed-to-Floating Series C Cumulative Redeemable Preferred Stock ,ACR$C,N
ACRpD,N,"",N, ,ACR-D,Y,N,100,ACRES Commercial Realty Corp. 7.875% Series D Cumulative Redeemable Preferred Stock,ACR$D,N
ACRE,N,"",N, ,ACRE,Y,N,100,Ares Commercial Real Estate Corporation Common Stock,ACRE,N
ACRO,N,"",N, ,ACRO,Y,N,100,Acropolis Infrastructure Acquisition Corp. Class A Common Stock,ACRO,N
ACRO.U,N,"",N, ,ACRO=,Y,N,100,"Acropolis Infrastructure Acquisition Corp. Units, each consisting of one share of Class A Common Stock and one-third of one Warrant",ACRO.U,N
ACRO.WS,N,"",N, ,ACRO+,Y,N,100,Acropolis Infrastructure Acquisition Corp. Warrants,ACRO.W,N
"",N,N,Q,Q,ACRS,Y,N,100,"Aclaris Therapeutics, Inc. - Common Stock",ACRS,N
"",N,N,Q,G,ACRV,Y,N,100,"Acrivon Therapeutics, Inc. - Common Stock",ACRV,N
"",N,N,Q,G,ACRX,Y,N,100,"AcelRx Pharmaceuticals, Inc. - Common Stock",ACRX,N
ACSI,Y,"",Z, ,ACSI,Y,N,100,American Customer Satisfaction ETF,ACSI,N
"",N,D,Q,S,ACST,Y,N,100,"Acasti Pharma, Inc.  - Class A Common Stock",ACST,N
"",N,N,Q,Q,ACT,Y,N,100,"Enact Holdings, Inc. - Common Stock",ACT,N
"",N,N,Q,Q,ACTG,Y,N,100,Acacia Research Corporation - Common Stock,ACTG,N
ACTV,Y,"",P, ,ACTV,Y,N,100,LeaderShares Activist Leaders ETF,ACTV,N
ACU,N,"",A, ,ACU,Y,N,100,Acme United Corporation. Common Stock,ACU,N
ACV,N,"",N, ,ACV,Y,N,100,Virtus Diversified Income & Convertible Fund Common Shares of Beneficial Interest,ACV,N
"",N,N,Q,Q,ACVA,Y,N,100,ACV Auctions Inc. - Class A Common Stock,ACVA,N
ACVF,Y,"",P, ,ACVF,Y,N,100,American Conservative Values ETF,ACVF,N
ACWF,Y,"",P, ,ACWF,Y,N,100,iShares MSCI Global Multifactor ETF,ACWF,N
"",Y,N,Q,G,ACWI,Y,N,100,iShares MSCI ACWI ETF,ACWI,N
ACWV,Y,"",Z, ,ACWV,Y,N,100,iShares MSCI Global Min Vol Factor ETF,ACWV,N
"",Y,N,Q,G,ACWX,Y,N,100,iShares MSCI ACWI ex US Index Fund,ACWX,N
"",N,N,Q,S,ACXP,Y,N,100,"Acurx Pharmaceuticals, Inc. - Common Stock",ACXP,N
"",N,N,Q,G,ADAG,Y,N,100,"Adagene Inc. - ADS, each representing 1.25 ordinary shares",ADAG,N
"",N,N,Q,G,ADAL,Y,N,100,Anthemis Digital Acquisitions I Corp - Class A Ordinary Shares,ADAL,N
"",N,N,Q,G,ADALU,Y,N,100,Anthemis Digital Acquisitions I Corp - Unit,ADALU,N
"",N,N,Q,G,ADALW,Y,N,100,Anthemis Digital Acquisitions I Corp - Warrant,ADALW,N
"",N,N,Q,Q,ADAP,Y,N,100,Adaptimmune Therapeutics plc - American Depositary Shares,ADAP,N
"",N,N,Q,Q,ADBE,Y,N,100,Adobe Inc. - Common Stock,ADBE,N
ADC,N,"",N, ,ADC,Y,N,100,Agree Realty Corporation Common Stock,ADC,N
ADCpA,N,"",N, ,ADC-A,Y,N,100,"Agree Realty Corporation Depositary Shares, each representing 1/1,000th of a 4.250% Series A Cumulative Redeemable Preferred Stock",ADC$A,N
ADCT,N,"",N, ,ADCT,Y,N,100,ADC Therapeutics SA Common Shares,ADCT,N
"",N,D,Q,S,ADD,Y,N,100,Color Star Technology Co. Ltd. - Ordinary Shares,ADD,N
"",N,N,Q,Q,ADEA,Y,N,100,Adeia Inc.  - Common Stock,ADEA,N
"",N,N,Q,S,ADER,Y,N,100,26 Capital Acquisition Corp. - Class A Common Stock,ADER,N
"",N,N,Q,S,ADERU,Y,N,100,26 Capital Acquisition Corp. - Unit,ADERU,N
"",N,N,Q,S,ADERW,Y,N,100,26 Capital Acquisition Corp. - Warrant,ADERW,N
"",N,N,Q,G,ADES,Y,N,100,"Advanced Emissions Solutions, Inc. - Common Stock",ADES,N
ADEX,N,"",N, ,ADEX,Y,N,100,Adit EdTech Acquisition Corp. Common Stock,ADEX,N
ADEX.U,N,"",N, ,ADEX=,Y,N,100,"Adit EdTech Acquisition Corp. Units, each consisting of one share of common stock, and one-half of one redeemable warrant",ADEX.U,N
ADEX.WS,N,"",N, ,ADEX+,Y,N,100,"Adit EdTech Acquisition Corp. Redeemable Warrants, each whole warrant exercisable for shares of common stock at an exercise price of $11.50 per share",ADEX.W,N
ADFI,Y,"",Z, ,ADFI,Y,N,100,Anfield Dynamic Fixed Income ETF,ADFI,N
"",N,N,Q,Q,ADI,Y,N,100,"Analog Devices, Inc. - Common Stock",ADI,N
"",N,D,Q,S,ADIL,Y,N,100,"Adial Pharmaceuticals, Inc - Common Stock",ADIL,N
"",N,N,Q,S,ADILW,Y,N,100,"Adial Pharmaceuticals, Inc - Warrant",ADILW,N
ADIV,Y,"",P, ,ADIV,Y,N,100,SmartETFs Asia Pacific Dividend Builder ETF,ADIV,N
ADM,N,"",N, ,ADM,Y,N,100,Archer-Daniels-Midland Company Common Stock,ADM,N
"",N,N,Q,G,ADMA,Y,N,100,ADMA Biologics Inc - Common Stock,ADMA,N
ADME,Y,"",Z, ,ADME,Y,N,100,Aptus Drawdown Managed Equity ETF,ADME,N
"",N,D,Q,S,ADMP,Y,N,100,Adamis Pharmaceuticals Corporation - Common Stock,ADMP,N
"",N,N,Q,S,ADN,Y,N,100,"Advent Technologies Holdings, Inc. - Class A Common Stock",ADN,N
ADNT,N,"",N, ,ADNT,Y,N,100,Adient plc Ordinary Shares ,ADNT,N
"",N,N,Q,S,ADNWW,Y,N,100,"Advent Technologies Holdings, Inc. - Warrant",ADNWW,N
"",N,D,Q,S,ADOC,Y,N,100,Edoc Acquisition Corp. - Class A Ordinary Share,ADOC,N
"",N,D,Q,S,ADOCR,Y,N,100,Edoc Acquisition Corp. - Right,ADOCR,N
"",N,D,Q,S,ADOCW,Y,N,100,Edoc Acquisition Corp. - Warrant,ADOCW,N
"",N,N,Q,Q,ADP,Y,N,100,"Automatic Data Processing, Inc. - Common Stock",ADP,N
"",N,N,Q,Q,ADPT,Y,N,100,Adaptive Biotechnologies Corporation - Common Stock,ADPT,N
ADPV,Y,"",P, ,ADPV,Y,N,100,Series Portfolios Trust Adaptiv Select ETF,ADPV,N
ADRA,N,"",A, ,ADRA,Y,N,100,Adara Acquisition Corp. Class A Common Stock,ADRA,N
ADRA.U,N,"",A, ,ADRA=,Y,N,100,"Adara Acquisition Corp. Units, each consisting of one share of Class A common stock, and one-half of one redeemable warrant",ADRA.U,N
ADRA.WS,N,"",A, ,ADRA+,Y,N,100,"Adara Acquisition Corp. Redeemable Warrants, each whole warrant exercisable for one share of Class A Common Stock at an exercise price of $11.50",ADRA.W,N
"",Y,N,Q,G,ADRE,Y,N,100,Invesco BLDRS Emerging Markets 50 ADR Index Fund,ADRE,N
ADRT,N,"",A, ,ADRT,Y,N,100,Ault Disruptive Technologies Corporation Common Stock,ADRT,N
ADRT.U,N,"",A, ,ADRT=,Y,N,100,"Ault Disruptive Technologies Corporation Units, each consisting of one share of Common Stock, and three-fourths of one Redeemable Warrant to purchase one share of Common Stock",ADRT.U,N
"",N,N,Q,S,ADSE,Y,N,100,ADS-TEC ENERGY PLC - Ordinary Shares,ADSE,N
"",N,N,Q,S,ADSEW,Y,N,100,ADS-TEC ENERGY PLC - Warrant,ADSEW,N
"",N,N,Q,Q,ADSK,Y,N,100,"Autodesk, Inc. - Common Stock",ADSK,N
ADT,N,"",N, ,ADT,Y,N,100,ADT Inc. Common Stock,ADT,N
"",N,N,Q,S,ADTH,Y,N,100,"AdTheorent Holding Company, Inc. - Common Stock",ADTH,N
"",N,N,Q,S,ADTHW,Y,N,100,"AdTheorent Holding Company, Inc. - Warrants",ADTHW,N
"",N,N,Q,Q,ADTN,Y,N,100,"ADTRAN Holdings, Inc. - Common Stock",ADTN,N
"",N,N,Q,S,ADTX,Y,N,100,"Aditxt, Inc. - Common Stock",ADTX,N
"",N,N,Q,Q,ADUS,Y,N,100,Addus HomeCare Corporation - Common Stock,ADUS,N
"",N,N,Q,Q,ADV,Y,N,100,Advantage Solutions Inc.  - Class A Common Stock,ADV,N
"",N,D,Q,G,ADVM,Y,N,100,"Adverum Biotechnologies, Inc. - Common Stock",ADVM,N
"",N,N,Q,Q,ADVWW,Y,N,100,Advantage Solutions Inc.  - Warrant,ADVWW,N
ADX,N,"",N, ,ADX,Y,N,100,Adams Diversified Equity Fund Inc.,ADX,N
"",N,D,Q,S,ADXN,Y,N,100,Addex Therapeutics Ltd - American Depositary Shares,ADXN,N
AE,N,"",A, ,AE,Y,N,100,"Adams Resources & Energy, Inc. Common Stock",AE,N
"",N,N,Q,S,AEAC,Y,N,100,Authentic Equity Acquisition Corp. - Class A ordinary share,AEAC,N
"",N,N,Q,S,AEACU,Y,N,100,Authentic Equity Acquisition Corp. - Unit,AEACU,N
"",N,N,Q,S,AEACW,Y,N,100,Authentic Equity Acquisition Corp. - Warrant,AEACW,N
"",N,N,Q,G,AEAE,Y,N,100,AltEnergy Acquisition Corp. - Class A Common Stock,AEAE,N
"",N,N,Q,G,AEAEU,Y,N,100,AltEnergy Acquisition Corp. - Unit,AEAEU,N
"",N,N,Q,G,AEAEW,Y,N,100,AltEnergy Acquisition Corp. - Warrant,AEAEW,N
AEE,N,"",N, ,AEE,Y,N,100,Ameren Corporation Common Stock,AEE,N
AEF,N,"",A, ,AEF,Y,N,100,"abrdn Emerging Markets Equity Income Fund, Inc. Common Stock",AEF,N
AEFC,N,"",N, ,AEFC,Y,N,100,Aegon Funding Company LLC 5.10% Subordinated Notes due 2049,AEFC,N
AEG,N,"",N, ,AEG,Y,N,100,AEGON N.V. Common Stock,AEG,N
"",N,N,Q,G,AEHA,Y,N,100,Aesther Healthcare Acquisition Corp - Class A Common Stock,AEHA,N
"",N,N,Q,G,AEHAU,Y,N,100,Aesther Healthcare Acquisition Corp - Units,AEHAU,N
"",N,N,Q,G,AEHAW,Y,N,100,Aesther Healthcare Acquisition Corp - Warrants,AEHAW,N
"",N,D,Q,S,AEHL,Y,N,100,Antelope Enterprise Holdings Limited - Common Stock,AEHL,N
"",N,N,Q,S,AEHR,Y,N,100,Aehr Test Systems - Common Stock,AEHR,N
"",N,N,Q,S,AEI,Y,N,100,Alset Inc. - Common Stock,AEI,N
"",N,N,Q,Q,AEIS,Y,N,100,"Advanced Energy Industries, Inc. - Common Stock",AEIS,N
AEL,N,"",N, ,AEL,Y,N,100,American Equity Investment Life Holding Company Common Stock,AEL,N
AELpA,N,"",N, ,AEL-A,Y,N,100,"American Equity Investment Life Holding Company Depositary Shares, each representing a 1/1,000th interest in a share of 5.95% Fixed-Rate Reset Non-Cumulative Preferred Stock, Series A",AEL$A,N
AELpB,N,"",N, ,AEL-B,Y,N,100,"American Equity Investment Life Holding Company Depositary Shares, each representing a 1/1,000th interest in a share of 6.625% Fixed-Rate Reset Non-Cumulative Preferred Stock, Series B",AEL$B,N
AEM,N,"",N, ,AEM,Y,N,100,Agnico Eagle Mines Limited Common Stock,AEM,N
AEMB,Y,"",P, ,AEMB,Y,N,100,American Century Emerging Markets Bond ETF,AEMB,N
"",N,D,Q,S,AEMD,Y,N,100,"Aethlon Medical, Inc. - Common Stock",AEMD,N
AENZ,N,"",N, ,AENZ,Y,N,100,Aenza S.A.A. American Depositary Shares,AENZ,N
AEO,N,"",N, ,AEO,Y,N,100,"American Eagle Outfitters, Inc. Common Stock",AEO,N
"",N,N,Q,Q,AEP,Y,N,100,"American Electric Power Company, Inc. - Common Stock",AEP,N
"",N,N,Q,Q,AEPPZ,Y,N,100,"American Electric Power Company, Inc. - Corporate Unit",AEPPZ,N
AER,N,"",N, ,AER,Y,N,100,AerCap Holdings N.V. Ordinary Shares,AER,N
AES,N,"",N, ,AES,Y,N,100,The AES Corporation Common Stock,AES,N
AESC,N,"",N, ,AESC,Y,N,100,The AES Corporation Corporate Units,AESC,N
AESR,Y,"",Z, ,AESR,Y,N,100,Anfield U.S. Equity Sector Rotation ETF,AESR,N
AEVA,N,"",N, ,AEVA,Y,N,100,"Aeva Technologies, Inc. Common Stock",AEVA,N
AEVA.WS,N,"",N, ,AEVA+,Y,N,100,"Aeva Technologies, Inc. Redeemable Warrants, each whole warrant exercisable for shares of common stock at an exercise price of $11.50 per share",AEVA.W,N
"",N,N,Q,S,AEY,Y,N,100,"ADDvantage Technologies Group, Inc. - Common Stock",AEY,N
"",N,N,Q,S,AEYE,Y,N,100,"AudioEye, Inc. - Common Stock",AEYE,N
"",N,N,Q,S,AEZS,Y,N,100,Aeterna Zentaris Inc. - Common Stock,AEZS,N
"",N,N,Q,G,AFAR,Y,N,100,Aura FAT Projects Acquisition Corp - Class A Ordinary Shares,AFAR,N
"",N,N,Q,G,AFARU,Y,N,100,Aura FAT Projects Acquisition Corp - Unit,AFARU,N
"",N,N,Q,G,AFARW,Y,N,100,Aura FAT Projects Acquisition Corp - Warrant,AFARW,N
AFB,N,"",N, ,AFB,Y,N,100,AllianceBernstein National Municipal Income Fund Inc,AFB,N
"",N,N,Q,S,AFBI,Y,N,100,"Affinity Bancshares, Inc. - Common Stock",AFBI,N
"",N,N,Q,G,AFCG,Y,N,100,"AFC Gamma, Inc. - Common Stock",AFCG,N
AFG,N,"",N, ,AFG,Y,N,100,"American Financial Group, Inc. Common Stock",AFG,N
AFGB,N,"",N, ,AFGB,Y,N,100,"American Financial Group, Inc. 5.875% Subordinated Debentures due 2059",AFGB,N
AFGC,N,"",N, ,AFGC,Y,N,100,"American Financial Group, Inc. 5.125% Subordinated Debentures due 2059",AFGC,N
AFGD,N,"",N, ,AFGD,Y,N,100,"American Financial Group, Inc. 5.625% Subordinated Debentures due 2060",AFGD,N
AFGE,N,"",N, ,AFGE,Y,N,100,"American Financial Group, Inc. 4.500% Subordinated Debentures due 2060",AFGE,N
"",N,N,Q,Q,AFIB,Y,N,100,"Acutus Medical, Inc. - Common Stock",AFIB,N
AFIF,Y,"",Z, ,AFIF,Y,N,100,Anfield Universal Fixed Income ETF,AFIF,N
AFK,Y,"",P, ,AFK,Y,N,100,VanEck Africa Index ETF,AFK,N
AFL,N,"",N, ,AFL,Y,N,100,AFLAC Incorporated Common Stock,AFL,N
AFLG,Y,"",P, ,AFLG,Y,N,100,First Trust Active Factor Large Cap ETF,AFLG,N
AFMC,Y,"",P, ,AFMC,Y,N,100,First Trust Active Factor Mid Cap ETF,AFMC,N
"",N,N,Q,G,AFMD,Y,N,100,Affimed N.V. - Common Stock,AFMD,N
"",N,N,Q,S,AFRI,Y,N,100,Forafric Global PLC - Ordinary Shares,AFRI,N
"",N,N,Q,S,AFRIW,Y,N,100,Forafric Global PLC - Warrants,AFRIW,N
"",N,N,Q,Q,AFRM,Y,N,100,"Affirm Holdings, Inc. - Class A Common Stock",AFRM,N
AFSM,Y,"",P, ,AFSM,Y,N,100,First Trust Active Factor Small Cap ETF,AFSM,N
AFT,N,"",N, ,AFT,Y,N,100,Apollo Senior Floating Rate Fund Inc. Common Stock,AFT,N
AFTR,N,"",N, ,AFTR,Y,N,100,AfterNext HealthTech Acquisition Corp. Class A Ordinary Shares,AFTR,N
AFTR.U,N,"",N, ,AFTR=,Y,N,100,"AfterNext HealthTech Acquisition Corp. Units, each consisting of one Class A ordinary share and one-third of one redeemable warrant",AFTR.U,N
AFTR.WS,N,"",N, ,AFTR+,Y,N,100,"AfterNext HealthTech Acquisition Corp. Redeemable warrants, each whole warrant exercisable for one Class A ordinary share at an exercise price of $11.50",AFTR.W,N
AFTY,Y,"",P, ,AFTY,Y,N,100,Pacer CSOP FTSE China A50 ETF,AFTY,N
"",N,N,Q,Q,AFYA,Y,N,100,Afya Limited - Class A Common Shares,AFYA,N
AG,N,"",N, ,AG,Y,N,100,First Majestic Silver Corp. Ordinary Shares (Canada),AG,N
AGAC,N,"",N, ,AGAC,Y,N,100,African Gold Acquisition Corporation Class A Ordinary Shares,AGAC,N
AGAC.U,N,"",N, ,AGAC=,Y,N,100,"African Gold Acquisition Corporation Units, each consisting of one Class A ordinary share and three-quarters of one redeemable warrant",AGAC.U,N
"",N,N,Q,S,AGAE,Y,N,100,Allied Gaming & Entertainment Inc. - Common Stock,AGAE,N
"",N,N,Q,S,AGBA,Y,N,100,AGBA Group Holding Limited - Ordinary Share,AGBA,N
"",N,N,Q,S,AGBAW,Y,N,100,AGBA Group Holding Limited - Warrant,AGBAW,N
AGCO,N,"",N, ,AGCO,Y,N,100,AGCO Corporation Common Stock,AGCO,N
AGD,N,"",N, ,AGD,Y,N,100,abrdn Global Dynamic Dividend Fund Common Shares of Beneficial Interest,AGD,N
AGE,N,"",A, ,AGE,Y,N,100,"AgeX Therapeutics, Inc. Common Stock",AGE,N
"",N,N,Q,S,AGEN,Y,N,100,Agenus Inc. - Common Stock,AGEN,N
"",N,N,Q,Q,AGFS,Y,N,100,"AgroFresh Solutions, Inc. - Common Stock",AGFS,N
"",N,N,Q,S,AGFY,Y,N,100,Agrify Corporation - Common Stock,AGFY,N
AGG,Y,"",P, ,AGG,Y,N,100,iShares Core U.S. Aggregate Bond ETF,AGG,N
AGGH,Y,"",P, ,AGGH,Y,N,100,Simplify Exchange Traded Funds Simplify Aggregate Bond PLUS Credit Hedge ETF,AGGH,N
"",N,N,Q,S,AGGR,Y,N,100,Agile Growth Corp. - Class A Ordinary Share,AGGR,N
"",N,N,Q,S,AGGRU,Y,N,100,Agile Growth Corp. - Units,AGGRU,N
"",N,N,Q,S,AGGRW,Y,N,100,Agile Growth Corp. - Warrant,AGGRW,N
AGGY,Y,"",P, ,AGGY,Y,N,100,WisdomTree Yield Enhanced U.S. Aggregate Bond Fund,AGGY,N
AGI,N,"",N, ,AGI,Y,N,100,Alamos Gold Inc. Class A Common Shares,AGI,N
AGIH,Y,"",P, ,AGIH,Y,N,100,iShares U.S. ETF Trust iShares Inflation Hedged U.S. Aggregate Bond ETF,AGIH,N
"",N,N,Q,S,AGIL,Y,N,100,"AgileThought, Inc. - Class A Common Stock",AGIL,N
"",N,N,Q,S,AGILW,Y,N,100,"AgileThought, Inc. - Warrant",AGILW,N
"",N,N,Q,Q,AGIO,Y,N,100,"Agios Pharmaceuticals, Inc. - Common Stock",AGIO,N
AGL,N,"",N, ,AGL,Y,N,100,"agilon health, inc. Common Stock",AGL,N
"",N,N,Q,G,AGLE,Y,N,100,"Aeglea BioTherapeutics, Inc. - Common Stock",AGLE,N
AGM,N,"",N, ,AGM,Y,N,100,Federal Agricultural Mortgage Corporation Common Stock,AGM,N
AGMpC,N,"",N, ,AGM-C,Y,N,100,Federal Agricultural Mortgage Corporation Preferred Series C Fixed to Fltg,AGM$C,N
AGMpD,N,"",N, ,AGM-D,Y,N,100,"Federal Agricultural Mortgage Corporation 5.700% Non-Cumulative Preferred Stock, Series D",AGM$D,N
AGMpE,N,"",N, ,AGM-E,Y,N,100,"Federal Agricultural Mortgage Corporation 5.750% Non-Cumulative Preferred Stock, Series E",AGM$E,N
AGMpF,N,"",N, ,AGM-F,Y,N,100,"Federal Agricultural Mortgage Corporation 5.250% Non-Cumulative Preferred Stock, Series F",AGM$F,N
AGMpG,N,"",N, ,AGM-G,Y,N,100,"Federal Agricultural Mortgage Corporation 4.875% Non-Cumulative Preferred Stock, Series G",AGM$G,N
AGM.A,N,"",N, ,AGM.A,Y,N,100,Federal Agricultural Mortgage Corporation Common Stock,AGM.A,N
"",N,N,Q,S,AGMH,Y,N,100,AGM Group Holdings Inc. - Class A Ordinary Shares,AGMH,N
"",N,N,Q,Q,AGNC,Y,N,100,AGNC Investment Corp. - Common Stock,AGNC,N
"",N,N,Q,Q,AGNCL,Y,N,100,"AGNC Investment Corp. - Depositary Shares Each Representing a 1/1,000th Interest in a Share of 7.75% Series G Fixed-Rate Reset Cumulative Redeemable Preferred Stock",AGNCL,N
"",N,N,Q,Q,AGNCM,Y,N,100,AGNC Investment Corp. - Depositary Shares rep 6.875% Series D Fixed-to-Floating Cumulative Redeemable Preferred Stock,AGNCM,N
"",N,N,Q,Q,AGNCN,Y,N,100,"AGNC Investment Corp. - Depositary Shares Each Representing a 1/1,000th Interest in a Share of 7.00% Series C Fixed-To-Floating Rate Cumulative Redeemable Preferred Stock",AGNCN,N
