CQS Symbol,ETF,Financial Status,Listing Exchange,Market Category,NASDAQ Symbol,Nasdaq Traded,NextShares,Round Lot Size,Security Name,Symbol,Test Issue
"",N,N,Q,S,DISAU,Y,N,100,Disruptive Acquisition Corporation I - Unit,DISAU,N
"",N,N,Q,S,DISAW,Y,N,100,Disruptive Acquisition Corporation I - Warrant,DISAW,N
"",N,N,Q,Q,DISH,Y,N,100,DISH Network Corporation - Class A Common Stock,DISH,N
DISV,Y,"",Z, ,DISV,Y,N,100,Dimensional ETF Trust Dimensional International Small Cap Value ETF,DISV,N
DIT,N,"",A, ,DIT,Y,N,10,AMCON Distributing Company Common Stock,DIT,N
DIV,Y,"",P, ,DIV,Y,N,100,Global X Super Dividend ETF,DIV,N
DIVB,Y,"",Z, ,DIVB,Y,N,100,iShares Core Dividend ETF,DIVB,N
"",Y,N,Q,G,DIVD,Y,N,100,Altrius Global Dividend ETF,DIVD,N
DIVI,Y,"",P, ,DIVI,Y,N,100,Franklin International Core Dividend Tilt Index ETF,DIVI,N
DIVO,Y,"",P, ,DIVO,Y,N,100,Amplify CWP Enhanced Dividend Income ETF,DIVO,N
DIVS,Y,"",P, ,DIVS,Y,N,100,SmartETFs Dividend Builder ETF,DIVS,N
DIVZ,Y,"",P, ,DIVZ,Y,N,100,TrueShares Low Volatility Equity Income ETF,DIVZ,N
DJAN,Y,"",Z, ,DJAN,Y,N,100,FT Cboe Vest U.S. Equity Deep Buffer ETF - January,DJAN,N
DJCB,Y,"",P, ,DJCB,Y,N,100,"ETRACS Bloomberg Commodity Index Total Return ETN Series B due October 31, 2039",DJCB,N
"",N,N,Q,S,DJCO,Y,N,100,Daily Journal Corp. (S.C.) - Common Stock,DJCO,N
DJD,Y,"",P, ,DJD,Y,N,100,Invesco Dow Jones Industrial Average Dividend ETF,DJD,N
DJIA,Y,"",P, ,DJIA,Y,N,100,Global X Funds Global X Dow 30 Covered Call ETF,DJIA,N
DJP,N,"",P, ,DJP,Y,N,100,iPath Bloomberg Commodity Index Total Return ETN,DJP,N
DJUL,Y,"",Z, ,DJUL,Y,N,100,FT Cboe Vest U.S. Equity Deep Buffer ETF - July,DJUL,N
DJUN,Y,"",Z, ,DJUN,Y,N,100,FT Cboe Vest U.S. Equity Deep Buffer ETF - June,DJUN,N
DK,N,"",N, ,DK,Y,N,100,"Delek US Holdings, Inc. Common Stock",DK,N
"",N,N,Q,S,DKDCA,Y,N,100,Data Knights Acquisition Corp. - Class A Common Stock,DKDCA,N
"",N,N,Q,S,DKDCU,Y,N,100,Data Knights Acquisition Corp. - Unit,DKDCU,N
"",N,N,Q,S,DKDCW,Y,N,100,Data Knights Acquisition Corp. - Warrant,DKDCW,N
DKL,N,"",N, ,DKL,Y,N,100,"Delek Logistics Partners, L.P. Common Units representing Limited Partner Interests",DKL,N
"",N,N,Q,Q,DKNG,Y,N,100,DraftKings Inc. - Class A Common Stock,DKNG,N
DKRB,Y,"",Z, ,DKRB,Y,N,100,Series Portfolios Trust Subversive Decarbonization ETF,DKRB,N
DKS,N,"",N, ,DKS,Y,N,100,Dick's Sporting Goods Inc Common Stock,DKS,N
DLA,N,"",A, ,DLA,Y,N,100,"Delta Apparel, Inc. Common Stock",DLA,N
DLB,N,"",N, ,DLB,Y,N,100,Dolby Laboratories Common Stock,DLB,N
"",N,N,Q,S,DLCA,Y,N,100,Deep Lake Capital Acquisition Corp. - Class A Ordinary Shares,DLCA,N
"",N,N,Q,S,DLCAU,Y,N,100,Deep Lake Capital Acquisition Corp. - Unit,DLCAU,N
"",N,N,Q,S,DLCAW,Y,N,100,Deep Lake Capital Acquisition Corp. - Warrant,DLCAW,N
"",N,N,Q,S,DLHC,Y,N,100,DLH Holdings Corp. - Common Stock,DLHC,N
DLN,Y,"",P, ,DLN,Y,N,100,WisdomTree U.S. LargeCap Dividend Fund,DLN,N
DLNG,N,"",N, ,DLNG,Y,N,100,Dynagas LNG Partners LP Common Units,DLNG,N
DLNGpA,N,"",N, ,DLNG-A,Y,N,100,Dynagas LNG Partners LP 9.00% Series A Cumulative Redeemable Preferred Units,DLNG$A,N
DLNGpB,N,"",N, ,DLNG-B,Y,N,100,"Dynagas LNG Partners LP 8.75% Series B Fixed to Floating Rate Cumulative Redeemable Perpetual Preferred Units, liquidation preference $25.00 per Uni",DLNG$B,N
"",N,N,Q,Q,DLO,Y,N,100,DLocal Limited - Class A Common Shares,DLO,N
"",N,N,Q,S,DLPN,Y,N,100,"Dolphin Entertainment, Inc. - Common Stock",DLPN,N
DLR,N,"",N, ,DLR,Y,N,100,"Digital Realty Trust, Inc. Common Stock",DLR,N
DLRpJ,N,"",N, ,DLR-J,Y,N,100,"Digital Realty Trust, Inc. 5.250% Series J Cumulative Redeemable Preferred Stock",DLR$J,N
DLRpK,N,"",N, ,DLR-K,Y,N,100,"Digital Realty Trust, Inc. 5.850% Series K Cumulative Redeemable Preferred Stock, par value $0.01 per share",DLR$K,N
DLRpL,N,"",N, ,DLR-L,Y,N,100,"Digital Realty Trust, Inc. 5.200% Series L Cumulative Redeemable Preferred Stock",DLR$L,N
DLS,Y,"",P, ,DLS,Y,N,100,WisdomTree International SmallCap Fund,DLS,N
"",N,N,Q,Q,DLTH,Y,N,100,Duluth Holdings Inc. - Class B Common Stock,DLTH,N
"",N,N,Q,Q,DLTR,Y,N,100,"Dollar Tree, Inc. - Common Stock",DLTR,N
DLX,N,"",N, ,DLX,Y,N,100,Deluxe Corporation Common Stock,DLX,N
DLY,N,"",N, ,DLY,Y,N,100,DoubleLine Yield Opportunities Fund Common Shares of Beneficial Interest,DLY,N
DM,N,"",N, ,DM,Y,N,100,"Desktop Metal, Inc. Class A Common Stock",DM,N
DMA,N,"",N, ,DMA,Y,N,100,Destra Multi-Alternative Fund Common Stock,DMA,N
"",N,N,Q,S,DMAC,Y,N,100,DiaMedica Therapeutics Inc. - Common Stock,DMAC,N
"",N,N,Q,G,DMAQ,Y,N,100,Deep Medicine Acquisition Corp. - Class A Common Stock,DMAQ,N
"",N,N,Q,G,DMAQR,Y,N,100,Deep Medicine Acquisition Corp. - Rights,DMAQR,N
DMAR,Y,"",Z, ,DMAR,Y,N,100,FT Cboe Vest U.S. Equity Deep Buffer ETF - March,DMAR,N
"",Y,N,Q,G,DMAT,Y,N,100,Global X Disruptive Materials ETF,DMAT,N
DMAY,Y,"",Z, ,DMAY,Y,N,100,FT Cboe Vest U.S. Equity Deep Buffer ETF - May,DMAY,N
DMB,N,"",N, ,DMB,Y,N,100,"BNY Mellon Municipal Bond Infrastructure Fund, Inc. Common Stock",DMB,N
DMCY,Y,"",P, ,DMCY,Y,N,100,Democracy International Fund,DMCY,N
DMDV,Y,"",P, ,DMDV,Y,N,100,AAM S&P Developed Markets High Dividend Value ETF,DMDV,N
DMF,N,"",A, ,DMF,Y,N,100,BNY Mellon Municipal Income Inc. Common Stock,DMF,N
"",N,N,Q,Q,DMLP,Y,N,100,"Dorchester Minerals, L.P. - Common Units Representing Limited Partnership Interests",DMLP,N
DMO,N,"",N, ,DMO,Y,N,100,Western Asset Mortgage Opportunity Fund Inc. Common Stock,DMO,N
"",N,N,Q,Q,DMRC,Y,N,100,Digimarc Corporation - Common Stock,DMRC,N
DMS,N,"",N, ,DMS,Y,N,100,"Digital Media Solutions, Inc. Class A Ordinary Shares",DMS,N
DMS.WS,N,"",N, ,DMS+,Y,N,100,"Digital Media Solutions, Inc. Warrants, ",DMS.W,N
"",N,N,Q,S,DMTK,Y,N,100,"DermTech, Inc. - Common Stock",DMTK,N
"",Y,N,Q,G,DMXF,Y,N,100,iShares ESG Advanced MSCI EAFE ETF,DMXF,N
DMYS,N,"",N, ,DMYS,Y,N,100,"dMY Technology Group, Inc. VI Class A Common Stock",DMYS,N
DMYS.U,N,"",N, ,DMYS=,Y,N,100,"dMY Technology Group, Inc. VI Units, each consisting of one share of Class A common stock and one-half of one redeemable warrant",DMYS.U,N
DMYS.WS,N,"",N, ,DMYS+,Y,N,100,"dMY Technology Group, Inc. VI Redeemable Warrants, each whole warrant exercisable for one share of Class A common stock at an exercise price of $11.50 per share",DMYS.W,N
DMYY,N,"",A, ,DMYY,Y,N,100,"dMY Squared Technology Group, Inc. Class A Common Stock",DMYY,N
DMYY.U,N,"",A, ,DMYY=,Y,N,100,"dMY Squared Technology Group, Inc. Units, each consisting of one share of Class A common stock and one-half of one redeemable warrant",DMYY.U,N
DMYY.WS,N,"",A, ,DMYY+,Y,N,100,"dMY Squared Technology Group, Inc. Redeemable Warrants, each whole warrant exercisable for one share of Class A common stock at an exercise price of $11.50 per share",DMYY.W,N
DNA,N,"",N, ,DNA,Y,N,100,"Ginkgo Bioworks Holdings, Inc. Class A Common Stock",DNA,N
DNA.WS,N,"",N, ,DNA+,Y,N,100,"Ginkgo Bioworks Holdings, Inc. Warrant",DNA.W,N
"",N,N,Q,S,DNAB,Y,N,100,Social Capital Suvretta Holdings Corp. II - Class A Ordinary Shares,DNAB,N
"",N,N,Q,S,DNAD,Y,N,100,Social Capital Suvretta Holdings Corp. IV - Class A Ordinary Shares,DNAD,N
DNB,N,"",N, ,DNB,Y,N,100,"Dun & Bradstreet Holdings, Inc. Common Stock",DNB,N
DNL,Y,"",P, ,DNL,Y,N,100,WisdomTree Global ex-US Quality Dividend Growth Fund,DNL,N
"",N,N,Q,Q,DNLI,Y,N,100,Denali Therapeutics Inc. - Common Stock,DNLI,N
DNMR,N,"",N, ,DNMR,Y,N,100,"Danimer Scientific, Inc. Common Stock",DNMR,N
DNN,N,"",A, ,DNN,Y,N,100,Denison Mines Corp Ordinary Shares (Canada),DNN,N
DNOV,Y,"",Z, ,DNOV,Y,N,100,FT Cboe Vest U.S. Equity Deep Buffer ETF - November,DNOV,N
DNOW,N,"",N, ,DNOW,Y,N,100,NOW Inc. Common Stock,DNOW,N
DNP,N,"",N, ,DNP,Y,N,100,"DNP Select Income Fund, Inc. Common Stock",DNP,N
"",N,N,Q,Q,DNUT,Y,N,100,"Krispy Kreme, Inc. - Common Stock",DNUT,N
DNZ,N,"",N, ,DNZ,Y,N,100,D and Z Media Acquisition Corp. Class A Common Stock,DNZ,N
DNZ.U,N,"",N, ,DNZ=,Y,N,100,"D and Z Media Acquisition Corp. Units, each consisting of one share of Class A Common Stock and one-third of one Warrant",DNZ.U,N
DNZ.WS,N,"",N, ,DNZ+,Y,N,100,"D and Z Media Acquisition Corp. Warrants, each whole warrant exercisable for one share of Class A Common Stock at an exercise price of $11.50",DNZ.W,N
DO,N,"",N, ,DO,Y,N,100,"Diamond Offshore Drilling, Inc. Common Stock",DO,N
DOC,N,"",N, ,DOC,Y,N,100,Physicians Realty Trust Common Shares of Beneficial Interest,DOC,N
DOCN,N,"",N, ,DOCN,Y,N,100,"DigitalOcean Holdings, Inc. Common Stock",DOCN,N
DOCS,N,"",N, ,DOCS,Y,N,100,"Doximity, Inc. Class A Common Stock",DOCS,N
DOCT,Y,"",Z, ,DOCT,Y,N,100,FT Cboe Vest U.S. Equity Deep Buffer ETF - October,DOCT,N
"",N,N,Q,Q,DOCU,Y,N,100,"DocuSign, Inc. - Common Stock",DOCU,N
DOG,Y,"",P, ,DOG,Y,N,100,ProShares Short Dow30,DOG,N
"",N,N,Q,G,DOGZ,Y,N,100,Dogness (International) Corporation - Class A Common Stock,DOGZ,N
DOL,Y,"",P, ,DOL,Y,N,100,WisdomTree International LargeCap Dividend Fund,DOL,N
DOLE,N,"",N, ,DOLE,Y,N,100,Dole plc Ordinary Shares,DOLE,N
DOMA,N,"",N, ,DOMA,Y,N,100,"Doma Holdings, Inc. Common Stock",DOMA,N
DOMA.WS,N,"",N, ,DOMA+,Y,N,100,"Doma Holdings, Inc. Warrants",DOMA.W,N
"",N,N,Q,S,DOMH,Y,N,100,Dominari Holdings Inc. - Common Stock,DOMH,N
"",N,N,Q,G,DOMO,Y,N,100,"Domo, Inc. - Class B Common Stock",DOMO,N
DON,Y,"",P, ,DON,Y,N,100,WisdomTree U.S. MidCap Dividend Fund,DON,N
"",N,N,Q,Q,DOOO,Y,N,100,BRP Inc. - Common Subordinate Voting Shares,DOOO,N
DOOR,N,"",N, ,DOOR,Y,N,100,Masonite International Corporation Ordinary Shares (Canada),DOOR,N
"",N,N,Q,Q,DORM,Y,N,100,"Dorman Products, Inc. - Common Stock",DORM,N
DOUG,N,"",N, ,DOUG,Y,N,100,Douglas Elliman Inc. Common Stock,DOUG,N
DOV,N,"",N, ,DOV,Y,N,100,Dover Corporation Common Stock,DOV,N
DOW,N,"",N, ,DOW,Y,N,100,Dow Inc. Common Stock ,DOW,N
"",N,N,Q,Q,DOX,Y,N,100,Amdocs Limited - Ordinary Shares,DOX,N
"",N,N,Q,Q,DOYU,Y,N,100,DouYu International Holdings Limited - American Depositary Shares,DOYU,N
DOZR,Y,"",P, ,DOZR,Y,N,100,Direxion Daily US Infrastructure Bull 2X Shares,DOZR,N
"",N,N,Q,G,DPCS,Y,N,100,DP Cap Acquisition Corp I - Class A Ordinary Shares,DPCS,N
"",N,N,Q,G,DPCSU,Y,N,100,DP Cap Acquisition Corp I - Unit,DPCSU,N
"",N,N,Q,G,DPCSW,Y,N,100,DP Cap Acquisition Corp I - Warrants,DPCSW,N
DPG,N,"",N, ,DPG,Y,N,100,Duff & Phelps Utility and Infrastructure Fund Inc.,DPG,N
"",N,D,Q,S,DPRO,Y,N,100,Draganfly Inc. - Common Shares,DPRO,N
DPSI,N,"",A, ,DPSI,Y,N,100,"DecisionPoint Systems, Inc. Common Stock",DPSI,N
DPST,Y,"",P, ,DPST,Y,N,100,Direxion Daily Regional Banks Bull 3X Shares,DPST,N
DPZ,N,"",N, ,DPZ,Y,N,100,Domino's Pizza Inc Common Stock,DPZ,N
DQ,N,"",N, ,DQ,Y,N,100,"DAQO New Energy Corp. American Depositary Shares, each representing five ordinary shares",DQ,N
"",N,N,Q,S,DRCT,Y,N,100,"Direct Digital Holdings, Inc. - Class A Common Stock",DRCT,N
"",N,N,Q,S,DRCTW,Y,N,100,"Direct Digital Holdings, Inc. - Warrant",DRCTW,N
DRD,N,"",N, ,DRD,Y,N,100,DRDGOLD Limited American Depositary Shares,DRD,N
DRH,N,"",N, ,DRH,Y,N,100,Diamondrock Hospitality Company Common Stock,DRH,N
DRHpA,N,"",N, ,DRH-A,Y,N,100,Diamondrock Hospitality Company 8.250% Series A Cumulative Redeemable Preferred Stock,DRH$A,N
DRI,N,"",N, ,DRI,Y,N,100,"Darden Restaurants, Inc. Common Stock",DRI,N
"",N,N,Q,S,DRIO,Y,N,100,DarioHealth Corp. - Common Stock,DRIO,N
DRIP,Y,"",P, ,DRIP,Y,N,100,Direxion Daily S&P Oil & Gas Exp. & Prod. Bear 2X Shares,DRIP,N
"",Y,N,Q,G,DRIV,Y,N,100,Global X Autonomous & Electric Vehicles ETF,DRIV,N
DRLL,Y,"",P, ,DRLL,Y,N,100,EA Series Trust Strive U.S. Energy ETF,DRLL,N
"",N,D,Q,S,DRMA,Y,N,100,"Dermata Therapeutics, Inc. - Common Stock",DRMA,N
"",N,N,Q,S,DRMAW,Y,N,100,"Dermata Therapeutics, Inc. - Warrant",DRMAW,N
DRN,Y,"",P, ,DRN,Y,N,100,Direxion Daily Real Estate Bull 3X Shares,DRN,N
DRQ,N,"",N, ,DRQ,Y,N,100,"Dril-Quip, Inc. Common Stock",DRQ,N
"",N,N,Q,S,DRRX,Y,N,100,DURECT Corporation - Common Stock,DRRX,N
"",N,N,Q,Q,DRS,Y,N,100,"Leonardo DRS, Inc. - Common Stock",DRS,N
DRSK,Y,"",Z, ,DRSK,Y,N,100,Aptus Defined Risk ETF ,DRSK,N
"",N,N,Q,S,DRTS,Y,N,100,Alpha Tau Medical Ltd. - Ordinary Shares,DRTS,N
"",N,N,Q,S,DRTSW,Y,N,100,Alpha Tau Medical Ltd. - Warrant,DRTSW,N
"",N,D,Q,Q,DRTT,Y,N,100,DIRTT Environmental Solutions Ltd. - Common Shares,DRTT,N
"",N,N,Q,S,DRUG,Y,N,100,Bright Minds Biosciences Inc. - common stock,DRUG,N
DRV,Y,"",P, ,DRV,Y,N,100,Direxion Daily Real Estate Bear 3X Shares,DRV,N
"",N,N,Q,Q,DRVN,Y,N,100,Driven Brands Holdings Inc. - Common Stock,DRVN,N
DSAQ,N,"",N, ,DSAQ,Y,N,100,Direct Selling Acquisition Corp. Class A Common Stock,DSAQ,N
DSAQ.U,N,"",N, ,DSAQ=,Y,N,100,"Direct Selling Acquisition Corp. Units, each consisting of one share of Class A common stock and one-half of redeemable warrant",DSAQ.U,N
DSCF,Y,"",Z, ,DSCF,Y,N,100,Discipline Fund ETF,DSCF,N
DSEP,Y,"",Z, ,DSEP,Y,N,100,FT Cboe Vest U.S. Equity Deep Buffer ETF - September,DSEP,N
"",N,N,Q,Q,DSEY,Y,N,100,"Diversey Holdings, Ltd. - Ordinary Shares",DSEY,N
"",N,N,Q,Q,DSGN,Y,N,100,"Design Therapeutics, Inc. - Common Stock",DSGN,N
"",N,N,Q,Q,DSGR,Y,N,100,"Distribution Solutions Group, Inc. - Common Stock",DSGR,N
"",N,N,Q,Q,DSGX,Y,N,100,The Descartes Systems Group Inc. - Common Stock,DSGX,N
DSI,Y,"",P, ,DSI,Y,N,100,iShares MSCI KLD 400 Social ETF,DSI,N
DSJA,Y,"",Z, ,DSJA,Y,N,100,Innovator Double Stacker ETF - January,DSJA,N
"",N,N,Q,S,DSKE,Y,N,100,"Daseke, Inc. - Common Stock",DSKE,N
DSL,N,"",N, ,DSL,Y,N,100,DoubleLine Income Solutions Fund Common Shares of Beneficial Interests,DSL,N
DSM,N,"",N, ,DSM,Y,N,100,"BNY Mellon Strategic Municipal Bond Fund, Inc. Common Stock",DSM,N
DSMC,Y,"",P, ,DSMC,Y,N,100,ETF Series Solutions Distillate Small/Mid Cash Flow ETF,DSMC,N
DSOC,Y,"",Z, ,DSOC,Y,N,100,Innovator Double Stacker ETF - October,DSOC,N
"",N,N,Q,Q,DSP,Y,N,100,Viant Technology Inc. - common stock,DSP,N
"",Y,N,Q,G,DSPC,Y,N,100,AXS De-SPAC ETF,DSPC,N
DSS,N,"",A, ,DSS,Y,N,100,"DSS, Inc. Common Stock",DSS,N
DSTL,Y,"",P, ,DSTL,Y,N,100,Distillate U.S. Fundamental Stability & Value ETF,DSTL,N
DSTX,Y,"",P, ,DSTX,Y,N,100,Distillate International Fundamental Stability & Value ETF,DSTX,N
DSU,N,"",N, ,DSU,Y,N,100,"Blackrock Debt Strategies Fund, Inc. Common Stock",DSU,N
"",N,N,Q,G,DSWL,Y,N,100,"Deswell Industries, Inc. - Common Shares",DSWL,N
DSX,N,"",N, ,DSX,Y,N,100,Diana Shipping inc. common stock,DSX,N
DSXpB,N,"",N, ,DSX-B,Y,N,100,Diana Shipping Inc. Perpetual Preferred Shares Series B (Marshall Islands),DSX$B,N
DT,N,"",N, ,DT,Y,N,100,"Dynatrace, Inc. Common Stock",DT,N
DTB,N,"",N, ,DTB,Y,N,100,DTE Energy Company 2020 Series G 4.375% Junior Subordinated Debentures due 2080,DTB,N
DTC,N,"",N, ,DTC,Y,N,100,"Solo Brands, Inc. Class A Common Stock",DTC,N
DTD,Y,"",P, ,DTD,Y,N,100,WisdomTree U.S. Total Dividend Fund,DTD,N
DTE,N,"",N, ,DTE,Y,N,100,DTE Energy Company Common Stock,DTE,N
"",N,D,Q,G,DTEA,Y,N,100,DAVIDsTEA Inc. - Common Stock,DTEA,N
DTEC,Y,"",P, ,DTEC,Y,N,100,ALPS ETF Trust ALPS Disruptive Technologies ETF,DTEC,N
DTF,N,"",N, ,DTF,Y,N,100,DTF Tax-Free Income 2028 Term Fund Inc. Common Stock,DTF,N
DTG,N,"",N, ,DTG,Y,N,100,DTE Energy Company 2021 Series E 4.375% Junior Subordinated Debentures,DTG,N
DTH,Y,"",P, ,DTH,Y,N,100,WisdomTree International High Dividend Fund,DTH,N
"",N,N,Q,Q,DTIL,Y,N,100,"Precision BioSciences, Inc. - Common Stock",DTIL,N
DTLAp,N,"",N, ,DTLA-,Y,N,100,Brookfield DTLA Inc. 7.625% Series A Cumulative Redeemable Preferred Stock,DTLA$,N
DTM,N,"",N, ,DTM,Y,N,100,"DT Midstream, Inc. Common Stock ",DTM,N
"",N,N,Q,S,DTOC,Y,N,100,Digital Transformation Opportunities Corp. - Class A Common Stock,DTOC,N
"",N,N,Q,S,DTOCU,Y,N,100,Digital Transformation Opportunities Corp. - Units,DTOCU,N
"",N,N,Q,S,DTOCW,Y,N,100,Digital Transformation Opportunities Corp. - Warrant,DTOCW,N
DTRE,Y,"",P, ,DTRE,Y,N,100,First Trust Alerian Disruptive Technology Real Estate ETF,DTRE,N
"",N,N,Q,S,DTRT,Y,N,100,DTRT Health Acquisition Corp. - Class A Common Stock,DTRT,N
"",N,N,Q,S,DTRTU,Y,N,100,DTRT Health Acquisition Corp. - Unit,DTRTU,N
"",N,N,Q,S,DTRTW,Y,N,100,DTRT Health Acquisition Corp. - Warrant,DTRTW,N
"",N,D,Q,S,DTSS,Y,N,100,Datasea Inc. - Common Stock,DTSS,N
"",N,N,Q,S,DTST,Y,N,100,Data Storage Corporation - Common Stock,DTST,N
"",N,N,Q,S,DTSTW,Y,N,100,Data Storage Corporation - Warrant,DTSTW,N
DTW,N,"",N, ,DTW,Y,N,100,DTE Energy Company 2017 Series E 5.25% Junior Subordinated Debentures due 2077,DTW,N
DUDE,Y,"",Z, ,DUDE,Y,N,100,Merlyn.AI SectorSurfer Momentum ETF,DUDE,N
"",N,N,Q,G,DUET,Y,N,100,DUET Acquisition Corp. - Class A Common Stock,DUET,N
"",N,N,Q,G,DUETU,Y,N,100,DUET Acquisition Corp. - Unit,DUETU,N
"",N,N,Q,G,DUETW,Y,N,100,DUET Acquisition Corp. - Warrant,DUETW,N
DUG,Y,"",P, ,DUG,Y,N,100,ProShares UltraShort Oil & Gas,DUG,N
DUHP,Y,"",P, ,DUHP,Y,N,100,Dimensional ETF Trust Dimensional US High Profitability ETF,DUHP,N
DUK,N,"",N, ,DUK,Y,N,100,Duke Energy Corporation (Holding Company) Common Stock,DUK,N
DUKpA,N,"",N, ,DUK-A,Y,N,100,"Duke Energy Corporation Depositary Shares, each representing a 1/1,000th interest in a share of 5.75% Series A Cumulative Redeemable Perpetual Preferred Stock",DUK$A,N
DUKB,N,"",N, ,DUKB,Y,N,100,Duke Energy Corporation 5.625% Junior Subordinated Debentures due 2078,DUKB,N
"",N,N,Q,S,DUNE,Y,N,100,Dune Acquisition Corporation - Class A Common Stock,DUNE,N
"",N,N,Q,S,DUNEU,Y,N,100,Dune Acquisition Corporation - Unit,DUNEU,N
"",N,N,Q,S,DUNEW,Y,N,100,Dune Acquisition Corporation - Warrant,DUNEW,N
"",N,D,Q,G,DUO,Y,N,100,Fangdd Network Group Ltd. - American Depositary Shares,DUO,N
"",N,N,Q,Q,DUOL,Y,N,100,"Duolingo, Inc. - Class A Common Stock",DUOL,N
"",N,N,Q,S,DUOT,Y,N,100,"Duos Technologies Group, Inc. - Common Stock",DUOT,N
DURA,Y,"",Z, ,DURA,Y,N,100,VanEck Durable High Dividend ETF,DURA,N
DUSA,Y,"",Z, ,DUSA,Y,N,100,Davis Fundamental ETF Trust Davis Select U.S. Equity ETF,DUSA,N
DUSL,Y,"",P, ,DUSL,Y,N,100,Direxion Daily Industrials Bull 3X Shares,DUSL,N
DUST,Y,"",P, ,DUST,Y,N,100,Direxion Daily Gold Miners Index Bear 2X Shares,DUST,N
DV,N,"",N, ,DV,Y,N,100,"DoubleVerify Holdings, Inc. Common Stock",DV,N
DVA,N,"",N, ,DVA,Y,N,100,DaVita Inc. Common Stock,DVA,N
"",Y,N,Q,G,DVAL,Y,N,100,BrandywineGLOBAL - Dynamic US Large Cap Value ETF,DVAL,N
"",N,N,Q,S,DVAX,Y,N,100,Dynavax Technologies Corporation - Common Stock,DVAX,N
"",Y,N,Q,G,DVLU,Y,N,100,First Trust Dorsey Wright Momentum & Value ETF,DVLU,N
DVN,N,"",N, ,DVN,Y,N,100,Devon Energy Corporation Common Stock,DVN,N
DVND,Y,"",P, ,DVND,Y,N,100,Touchstone ETF Trust Touchstone Dividend Select ETF,DVND,N
"",Y,N,Q,G,DVOL,Y,N,100,First Trust Dorsey Wright Momentum & Low Volatility ETF,DVOL,N
"",Y,N,Q,G,DVY,Y,N,100,iShares Select Dividend ETF,DVY,N
DVYA,Y,"",P, ,DVYA,Y,N,100,iShares Asia / Pacific Dividend 30 Index Fund Exchange Traded Fund,DVYA,N
DVYE,Y,"",P, ,DVYE,Y,N,100,iShares Emerging Markets Dividend Index Fund Exchange Traded Fund,DVYE,N
"",N,N,Q,G,DWAC,Y,N,100,Digital World Acquisition Corp. - Class A Common Stock,DWAC,N
"",N,N,Q,G,DWACU,Y,N,100,Digital World Acquisition Corp. - Units,DWACU,N
"",N,N,Q,G,DWACW,Y,N,100,Digital World Acquisition Corp. - Warrants,DWACW,N
"",Y,N,Q,G,DWAS,Y,N,100,Invesco DWA SmallCap Momentum ETF,DWAS,N
DWAT,Y,"",Z, ,DWAT,Y,N,100,Arrow Investments Trust Arrow DWA Tactical ETF,DWAT,N
"",Y,N,Q,G,DWAW,Y,N,100,AdvisorShares Dorsey Wright FSM All Cap World ETF,DWAW,N
DWCR,Y,"",Z, ,DWCR,Y,N,100,Arrow Investments Trust Arrow DWA Country Rotation ETF,DWCR,N
"",Y,N,Q,G,DWEQ,Y,N,100,AdvisorShares Dorsey Wright Alpha Equal Weight ETF,DWEQ,N
DWLD,Y,"",Z, ,DWLD,Y,N,100,Davis Fundamental ETF Trust Davis Select Worldwide ETF,DWLD,N
DWM,Y,"",P, ,DWM,Y,N,100,WisdomTree International Equity Fund,DWM,N
"",Y,N,Q,G,DWMC,Y,N,100,AdvisorShares Dorsey Wright Micro-Cap ETF,DWMC,N
DWMF,Y,"",P, ,DWMF,Y,N,100,WisdomTree International Multifactor Fund,DWMF,N
"",Y,N,Q,G,DWSH,Y,N,100,AdvisorShares Dorsey Wright Short ETF,DWSH,N
"",N,N,Q,Q,DWSN,Y,N,100,Dawson Geophysical Company - Common Stock,DWSN,N
"",Y,N,Q,G,DWUS,Y,N,100,AdvisorShares Dorsey Wright FSM US Core ETF,DWUS,N
DWX,Y,"",P, ,DWX,Y,N,100,SPDR S&P International Dividend ETF,DWX,N
DX,N,"",N, ,DX,Y,N,100,"Dynex Capital, Inc. Common Stock",DX,N
DXpC,N,"",N, ,DX-C,Y,N,100,"Dynex Capital, Inc. 6.900% Series C Fixed-to-Floating Rate Cumulative Redeemable Preferred Stock",DX$C,N
DXC,N,"",N, ,DXC,Y,N,100,DXC Technology Company Common Stock ,DXC,N
"",N,N,Q,Q,DXCM,Y,N,100,"DexCom, Inc. - Common Stock",DXCM,N
DXD,Y,"",P, ,DXD,Y,N,100,ProShares UltraShort Dow30,DXD,N
DXF,N,"",A, ,DXF,Y,N,100,Dunxin Financial Holdings Limited American Depositary Shares,DXF,N
"",Y,N,Q,G,DXGE,Y,N,100,WisdomTree Germany Hedged Equity Fund,DXGE,N
DXJ,Y,"",P, ,DXJ,Y,N,100,WisdomTree Japan Hedged Equity Fund,DXJ,N
"",Y,N,Q,G,DXJS,Y,N,100,WisdomTree Japan Hedged SmallCap Equity Fund,DXJS,N
"",N,N,Q,G,DXLG,Y,N,100,"Destination XL Group, Inc. - Common Stock",DXLG,N
"",N,N,Q,Q,DXPE,Y,N,100,"DXP Enterprises, Inc. - Common Stock",DXPE,N
"",N,N,Q,S,DXR,Y,N,100,Daxor Corporation - Common Stock,DXR,N
"",N,N,Q,G,DXYN,Y,N,100,"The Dixie Group, Inc. - Common Stock",DXYN,N
DY,N,"",N, ,DY,Y,N,100,"Dycom Industries, Inc. Common Stock",DY,N
"",N,N,Q,S,DYAI,Y,N,100,"Dyadic International, Inc. - Common Stock",DYAI,N
DYLD,Y,"",P, ,DYLD,Y,N,100,LeaderShares Dynamic Yield ETF,DYLD,N
"",N,N,Q,Q,DYN,Y,N,100,"Dyne Therapeutics, Inc. - Common Stock",DYN,N
DYNF,Y,"",P, ,DYNF,Y,N,100,BlackRock U.S. Equity Factor Rotation ETF,DYNF,N
"",N,D,Q,S,DYNT,Y,N,100,Dynatronics Corporation - Common Stock,DYNT,N
"",N,N,Q,S,DZSI,Y,N,100,DZS Inc. - Common Stock,DZSI,N
DZZ,N,"",P, ,DZZ,Y,N,100,"DB Gold Double Short ETN due February 15, 2038",DZZ,N
E,N,"",N, ,E,Y,N,100,ENI S.p.A. Common Stock,E,N
"",N,N,Q,Q,EA,Y,N,100,Electronic Arts Inc. - Common Stock,EA,N
"",N,N,Q,S,EAC,Y,N,100,Edify Acquisition Corp. - Class A Common Stock,EAC,N
"",N,N,Q,S,EACPU,Y,N,100,Edify Acquisition Corp. - Units,EACPU,N
"",N,N,Q,S,EACPW,Y,N,100,Edify Acquisition Corp. - Warrant,EACPW,N
EAD,N,"",A, ,EAD,Y,N,100,Allspring Income Opportunities Fund Common Shares,EAD,N
EAF,N,"",N, ,EAF,Y,N,100,GrafTech International Ltd. Common Stock,EAF,N
EAFD,Y,"",P, ,EAFD,Y,N,100,Simplify Exchange Traded Funds Simplify Developed Ex-US PLUS Downside Convexity ETF,EAFD,N
EAGG,Y,"",P, ,EAGG,Y,N,100,iShares ESG Aware U.S. Aggregate Bond ETF,EAGG,N
EAI,N,"",N, ,EAI,Y,N,100,"Entergy Arkansas, LLC First Mortgage Bonds, 4.875% Series Due September 1, 2066",EAI,N
EAOA,Y,"",Z, ,EAOA,Y,N,100,iShares ESG Aware Aggressive Allocation ETF,EAOA,N
EAOK,Y,"",Z, ,EAOK,Y,N,100,iShares ESG Aware Conservative Allocation ETF,EAOK,N
EAOM,Y,"",Z, ,EAOM,Y,N,100,iShares ESG Aware Moderate Allocation ETF,EAOM,N
EAOR,Y,"",Z, ,EAOR,Y,N,100,iShares ESG Aware Growth Allocation ETF,EAOR,N
EAPR,Y,"",P, ,EAPR,Y,N,100,Innovator Emerging Markets Power Buffer ETF April,EAPR,N
"",N,D,Q,Q,EAR,Y,N,100,"Eargo, Inc. - Common Stock",EAR,N
EARN,N,"",N, ,EARN,Y,N,100,Ellington Residential Mortgage REIT Common Shares of Beneficial Interest,EARN,N
EASG,Y,"",P, ,EASG,Y,N,100,Xtrackers MSCI EAFE ESG Leaders Equity ETF,EASG,N
"",N,D,Q,S,EAST,Y,N,100,"Eastside Distilling, Inc. - Common Stock",EAST,N
EAT,N,"",N, ,EAT,Y,N,100,"Brinker International, Inc. Common Stock",EAT,N
EATV,Y,"",P, ,EATV,Y,N,100,Advisors Series Trust VegTech Plant-based Innovation & Climate ETF,EATV,N
EATZ,Y,"",P, ,EATZ,Y,N,100,AdvisorShares Restaurant ETF,EATZ,N
EB,N,"",N, ,EB,Y,N,100,"Eventbrite, Inc. Class A Common Stock",EB,N
"",N,N,Q,S,EBAC,Y,N,100,European Biotech Acquisition Corp. - Class A Ordinary Shares,EBAC,N
"",N,N,Q,S,EBACU,Y,N,100,European Biotech Acquisition Corp. - Units,EBACU,N
"",N,N,Q,S,EBACW,Y,N,100,European Biotech Acquisition Corp. - Warrant,EBACW,N
"",N,N,Q,Q,EBAY,Y,N,100,eBay Inc. - Common Stock,EBAY,N
"",N,N,Q,Q,EBC,Y,N,100,"Eastern Bankshares, Inc. - Common Stock",EBC,N
"",N,D,Q,S,EBET,Y,N,100,"EBET, INC. - Common Stock",EBET,N
EBF,N,"",N, ,EBF,Y,N,100,"Ennis, Inc. Common Stock",EBF,N
"",N,N,Q,Q,EBIX,Y,N,100,"Ebix, Inc. - Common Stock",EBIX,N
"",Y,N,Q,G,EBIZ,Y,N,100,Global X E-commerce ETF,EBIZ,N
EBLU,Y,"",P, ,EBLU,Y,N,100,Ecofin Global Water ESG Fund,EBLU,N
"",N,N,Q,G,EBMT,Y,N,100,"Eagle Bancorp Montana, Inc. - Common Stock",EBMT,N
EBND,Y,"",P, ,EBND,Y,N,100,SPDR Bloomberg Emerging Markets Local Bond ETF,EBND,N
"",N,N,Q,Q,EBON,Y,N,100,Ebang International Holdings Inc. - Class A Ordinary Shares,EBON,N
EBR,N,"",N, ,EBR,Y,N,100,Centrais Electricas Brasileiras S A American Depositary Shares (Each representing one Common Share),EBR,N
EBR.B,N,"",N, ,EBR.B,Y,N,100,Centrais Electricas Brasileiras S.A.- Eletrobr?!s American Depositary Shares (Each representing one Preferred Share),EBR.B,N
EBS,N,"",N, ,EBS,Y,N,100,"Emergent Biosolutions, Inc. Common Stock",EBS,N
"",N,N,Q,Q,EBTC,Y,N,100,Enterprise Bancorp Inc - Common Stock,EBTC,N
EC,N,"",N, ,EC,Y,N,100,Ecopetrol S.A. American Depositary Shares,EC,N
ECAT,N,"",N, ,ECAT,Y,N,100,BlackRock ESG Capital Allocation Trust Common Shares of Beneficial Interest,ECAT,N
"",N,N,Q,S,ECBK,Y,N,100,"ECB Bancorp, Inc. - Common Stock",ECBK,N
ECC,N,"",N, ,ECC,Y,N,100,Eagle Point Credit Company Inc. Common Stock,ECC,N
ECCpD,N,"",N, ,ECC-D,Y,N,100,Eagle Point Credit Company Inc. 6.75% Series D Preferred Stock,ECC$D,N
ECCC,N,"",N, ,ECCC,Y,N,100,Eagle Point Credit Company Inc. 6.50% Series C Term Preferred Stock due 2031,ECCC,N
ECCV,N,"",N, ,ECCV,Y,N,100,Eagle Point Credit Company Inc. 5.375% Notes due 2029,ECCV,N
ECCW,N,"",N, ,ECCW,Y,N,100,Eagle Point Credit Company Inc. 6.75% Notes due 2031,ECCW,N
ECCX,N,"",N, ,ECCX,Y,N,100,Eagle Point Credit Company Inc. 6.6875% Notes due 2028,ECCX,N
ECF,N,"",A, ,ECF,Y,N,100,Ellsworth Growth and Income Fund Ltd.,ECF,N
ECFpA,N,"",A, ,ECF-A,Y,N,100,Ellsworth Growth and Income Fund Ltd. 5.25% Series A Cumulative Preferred Shares (Liquidation Preference $25.00 per share),ECF$A,N
ECH,Y,"",Z, ,ECH,Y,N,100,iShares Inc. iShares MSCI Chile ETF,ECH,N
ECL,N,"",N, ,ECL,Y,N,100,Ecolab Inc. Common Stock,ECL,N
ECLN,Y,"",P, ,ECLN,Y,N,100,First Trust EIP Carbon Impact ETF,ECLN,N
ECNS,Y,"",P, ,ECNS,Y,N,100,iShares MSCI China Small-Cap ETF,ECNS,N
ECON,Y,"",P, ,ECON,Y,N,100,Columbia Emerging Markets Consumer ETF,ECON,N
"",N,D,Q,S,ECOR,Y,N,100,"electroCore, Inc. - Common Stock",ECOR,N
